67304500,0.6,0.1,18.5,10.97,2.7,15.0,0.35,5.0,0.0,0.0,0.008,177.0,69.0,"Prunes with oatmeal, baby food, strained",9004,Baby food: fruit,3,Other
67306000,0.6,0.1,18.5,10.97,2.7,15.0,0.35,5.0,0.0,0.0,0.008,177.0,69.0,"Ciruelas, baby food",9004,Baby food: fruit,3,Other
67307000,0.3,0.0,16.8,1.4,1.5,8.0,0.28,0.0,0.0,0.0,0.0,123.0,62.0,"Apricots, baby food, NS as to strained or junior",9004,Baby food: fruit,3,Other
67307010,0.3,0.0,16.3,1.41,1.5,9.0,0.3,0.0,0.0,0.0,0.0,121.0,60.0,"Apricots, baby food, strained",9004,Baby food: fruit,3,Other
67307020,0.3,0.0,17.3,1.4,1.5,8.0,0.27,0.0,0.0,0.0,0.0,125.0,63.0,"Apricots, baby food, junior",9004,Baby food: fruit,3,Other
67308000,0.4,0.15,16.55,3.74,1.6,6.0,0.25,0.0,0.0,0.0,0.056,98.0,62.0,"Bananas, baby food, NS as to strained or junior",9004,Baby food: fruit,3,Other
67308020,0.4,0.2,17.8,7.1,1.6,8.0,0.3,0.0,0.0,0.0,0.076,108.0,67.0,"Bananas, baby food, junior",9004,Baby food: fruit,3,Other
67309000,0.2,0.05,18.1,9.57,1.6,7.0,0.18,0.0,0.0,0.0,0.018,73.0,66.0,"Bananas and pineapple, baby food, NS as to strained or junior",9004,Baby food: fruit,3,Other
67309010,0.2,0.0,17.8,10.73,1.6,7.0,0.23,0.0,0.0,0.0,0.0,68.0,65.0,"Bananas and pineapple, baby food, strained",9004,Baby food: fruit,3,Other
67309020,0.2,0.1,18.4,8.41,1.6,7.0,0.13,0.0,0.0,0.0,0.036,78.0,68.0,"Bananas and pineapple, baby food, junior",9004,Baby food: fruit,3,Other
67404010,0.3,0.0,16.0,12.6,0.6,9.0,0.22,0.0,0.0,0.0,0.0,94.0,59.0,"Fruit dessert, baby food, strained",9012,Baby food: snacks and sweets,3,Other
67404020,0.3,0.0,17.2,12.0,0.6,9.0,0.21,0.0,0.0,0.0,0.0,95.0,63.0,"Fruit dessert, baby food, junior",9012,Baby food: snacks and sweets,3,Other
67404070,0.8,1.6,19.5,12.02,0.5,6.0,0.0,20.0,0.0,6.0,1.034,70.0,96.0,"Apple yogurt dessert, baby food, strained",9010,Baby food: yogurt,3,Other
67404110,0.3,0.2,16.3,14.66,1.0,3.0,0.1,7.0,0.0,0.0,0.058,71.0,68.0,"Banana apple dessert, baby food, strained",9012,Baby food: snacks and sweets,3,Other
67404500,0.8,0.8,16.23,11.74,0.4,28.0,0.2,16.0,0.0,0.0,0.517,62.0,75.0,"Mixed fruit yogurt dessert, baby food, strained",9010,Baby food: yogurt,3,Other
67408010,1.0,0.8,14.14,10.55,0.8,11.0,0.3,54.0,0.1,29.0,0.264,90.0,68.0,"Banana pudding, baby food, strained",9012,Baby food: snacks and sweets,3,Other
67408500,1.1,0.52,17.35,3.95,0.5,30.0,0.14,14.0,0.0,1.0,0.37,100.0,78.0,"Banana yogurt dessert, baby food, strained",9010,Baby food: yogurt,3,Other
67410000,0.2,0.25,18.1,13.06,0.3,5.0,0.18,0.0,0.0,10.0,0.072,34.0,68.0,"Cherry vanilla pudding, baby food, strained",9012,Baby food: snacks and sweets,4,Other
67413700,0.9,0.18,17.6,6.63,0.4,27.0,0.4,14.0,0.0,4.0,0.117,102.0,76.0,"Peach yogurt dessert, baby food, strained",9010,Baby food: yogurt,3,Other
67414010,1.3,0.3,20.3,10.28,0.7,31.0,0.18,0.0,0.3,0.0,0.099,81.0,81.0,"Pineapple dessert, baby food, strained",9012,Baby food: snacks and sweets,4,Other
67414100,0.3,0.2,19.0,13.0,1.1,8.0,0.2,4.0,0.0,0.0,0.039,59.0,70.0,"Mango dessert, baby food",9012,Baby food: snacks and sweets,3,Other
67430000,0.0,0.02,86.68,57.4,0.0,12.0,0.24,89.0,0.0,0.0,0.0,54.0,347.0,"Fruit flavored snack, baby food",9012,Baby food: snacks and sweets,4,Other
67430500,14.29,4.0,71.43,57.14,2.3,457.0,0.0,286.0,0.1,0.0,2.236,714.0,429.0,"Yogurt and fruit snack, baby food",9010,Baby food: yogurt,4,Other
67501000,2.16,1.38,10.87,7.9,1.8,18.0,0.38,12.0,0.0,5.0,0.347,95.0,65.0,"Apples and chicken, baby food, strained",9008,Baby food: meat and dinners,3,Other
67501100,2.6,0.9,10.9,7.98,1.8,4.0,0.3,9.0,0.1,8.0,0.25,120.0,62.0,"Apples with ham, baby food, strained",9008,Baby food: meat and dinners,3,Other
67600100,0.3,0.22,15.3,11.6,1.4,8.0,0.2,3.0,0.0,0.0,0.041,149.0,64.0,"Apples and sweetpotatoes, baby food, strained",9004,Baby food: fruit,3,Other
71001000,2.02,0.09,17.47,0.78,2.2,12.0,0.78,6.0,0.0,0.0,0.026,421.0,77.0,"White potato, raw, with or without peel (assume peel not eaten)",6802,"White potatoes, baked or boiled",1,Vegetable
71201050,7.1,20.8,66.9,0.22,5.9,21.0,1.35,492.0,0.0,0.0,4.16,1744.0,471.0,"White potato, chips, reduced fat",5002,Potato chips,4,Other
71201080,9.64,0.6,83.76,3.69,7.5,35.0,3.57,643.0,0.0,0.0,0.15,1628.0,379.0,"White potato, chips, fat free",5002,Potato chips,4,Other
71201090,7.74,0.7,65.0,0.0,6.8,35.0,2.4,554.0,0.0,0.0,0.24,1160.0,274.0,"White potato, chips, fat free, made with Olean",5002,Potato chips,4,Other
71201100,4.45,38.41,52.02,1.14,3.1,27.0,0.82,388.0,0.0,0.0,9.492,751.0,559.0,"White potato, chips, restructured",5002,Potato chips,4,Other
71201200,4.56,26.14,64.9,0.63,3.2,29.0,1.11,411.0,0.0,0.0,6.759,760.0,502.0,"White potato, chips, restructured, reduced fat and reduced sodium",5002,Potato chips,4,Other
71201210,5.06,0.93,56.0,0.59,7.3,20.0,1.14,429.0,0.0,0.0,0.355,931.0,253.0,"White potato, chips, restructured, fat free, made with Olean",5002,Potato chips,4,Other
71201250,5.0,18.2,71.4,5.01,4.8,125.0,0.8,634.0,0.0,0.0,2.631,721.0,469.0,"White potato, chips, restructured, baked",5002,Potato chips,4,Other
71202000,7.0,34.6,52.9,0.22,4.8,24.0,1.63,8.0,0.0,0.0,10.96,1275.0,536.0,"White potato, chips, unsalted",5002,Potato chips,4,Other
71202100,7.1,20.8,67.8,0.22,6.1,21.0,1.35,8.0,0.0,0.0,4.16,1744.0,487.0,"White potato, chips, unsalted, reduced fat",5002,Potato chips,4,Other
71205000,6.7,34.4,53.3,0.22,3.4,18.0,2.27,633.0,0.0,0.0,8.88,1237.0,522.0,"White potato, sticks",5002,Potato chips,4,Other
71211000,4.45,38.41,52.02,1.14,3.1,27.0,0.82,388.0,0.0,0.0,9.492,751.0,559.0,"White potato skins, chips",5002,Potato chips,4,Other
71220000,5.32,23.3,60.43,4.04,4.7,52.0,1.55,966.0,0.0,0.0,1.762,838.0,473.0,Vegetable chips,5004,"Tortilla, corn, other chips",4,Other
71401020,2.66,5.22,27.74,0.28,2.8,12.0,0.74,388.0,0.0,0.0,1.029,451.0,164.0,"White potato, french fries, from frozen, oven baked",6804,French fries and other fried white potatoes,4,Other
71401030,3.76,16.12,38.44,0.69,3.5,13.0,1.37,290.0,0.0,0.0,2.084,550.0,314.0,"White potato, french fries, from frozen, deep fried",6804,French fries and other fried white potatoes,4,Other
71402040,5.83,19.6,31.14,4.26,1.6,99.0,1.24,409.0,0.0,1.0,3.573,321.0,322.0,"White potato, french fries, breaded or battered",6804,French fries and other fried white potatoes,4,Other
71405020,2.61,21.65,32.2,0.24,2.7,16.0,0.67,518.0,0.0,0.0,4.947,356.0,327.0,"White potato, hash brown, from frozen",6804,French fries and other fried white potatoes,4,Other
71405030,3.14,11.43,27.93,1.56,2.0,15.0,1.5,271.0,0.0,0.0,4.466,433.0,217.0,"White potato, hash brown, from dry mix",6804,French fries and other fried white potatoes,4,Other
71501000,1.65,2.82,14.65,0.5,1.3,18.0,0.31,306.0,0.0,0.0,0.577,286.0,89.0,"White potato, mashed, NFS",6806,Mashed potatoes and white potato mixtures,4,Other
71501200,1.99,0.86,14.2,0.62,1.2,28.0,0.64,160.0,0.0,0.0,0.203,338.0,71.0,"White potato, from complete dry mix, mashed, made with water",6806,Mashed potatoes and white potato mixtures,4,Other
71505000,2.05,8.62,27.75,0.25,2.5,14.0,0.64,480.0,0.0,0.0,1.823,312.0,190.0,"White potato, puffs",6804,French fries and other fried white potatoes,4,Other
71905000,1.3,0.37,31.89,15.0,2.3,3.0,0.6,4.0,0.0,0.0,0.143,499.0,122.0,"Ripe plantain, raw",6418,Other starchy vegetables,1,Vegetable
71905410,2.28,29.59,63.84,0.92,3.5,9.0,0.97,202.0,0.0,0.0,8.337,786.0,531.0,Plantain chips,5004,"Tortilla, corn, other chips",4,Other
71980200,2.3,24.9,68.1,3.82,7.2,60.0,1.2,342.0,0.0,0.0,6.43,755.0,498.0,Taro chips,5004,"Tortilla, corn, other chips",4,Other
72101100,2.2,0.13,4.33,0.5,3.7,117.0,2.57,226.0,0.0,0.0,0.02,762.0,22.0,"Beet greens, raw",6408,"Dark green vegetables, excludes lettuce",1,Vegetable
72104100,1.8,0.2,3.74,1.1,1.6,51.0,1.8,213.0,0.0,0.0,0.03,379.0,19.0,"Chard, raw",6408,"Dark green vegetables, excludes lettuce",1,Vegetable
72107100,2.45,0.42,5.69,0.46,3.6,145.0,0.19,20.0,0.0,0.0,0.055,169.0,30.0,"Collards, raw",6408,"Dark green vegetables, excludes lettuce",1,Vegetable
72110100,2.6,0.7,5.5,4.4,1.1,81.0,1.3,14.0,0.0,0.0,0.023,606.0,32.0,"Cress, raw",6408,"Dark green vegetables, excludes lettuce",1,Vegetable
72113100,2.7,0.7,9.2,0.71,3.5,187.0,3.1,76.0,0.0,0.0,0.17,397.0,45.0,"Dandelion greens, raw",6408,"Dark green vegetables, excludes lettuce",1,Vegetable
72122100,2.7,0.2,4.9,1.6,3.3,103.0,1.46,25.0,0.0,0.0,0.01,354.0,26.0,"Mustard greens, raw",6408,"Dark green vegetables, excludes lettuce",1,Vegetable
72124100,1.43,0.25,4.48,0.6,0.9,19.0,0.57,22.0,0.0,0.0,0.06,302.0,23.0,"Radicchio, raw",6410,Lettuce and lettuce salads,1,Vegetable
72125100,2.86,0.39,3.63,0.42,2.2,99.0,2.71,79.0,0.0,0.0,0.063,558.0,23.0,"Spinach, raw",6408,"Dark green vegetables, excludes lettuce",1,Vegetable
72125213,2.81,0.5,3.4,0.4,2.4,127.0,2.3,322.0,0.0,0.0,0.081,346.0,23.0,"Spinach, cooked, from canned, fat not added in cooking",6408,"Dark green vegetables, excludes lettuce",3,Vegetable
72130100,2.3,0.1,1.29,0.2,0.5,120.0,0.2,41.0,0.0,0.0,0.027,330.0,11.0,"Watercress, raw",6408,"Dark green vegetables, excludes lettuce",1,Vegetable
72201100,2.82,0.37,6.64,1.7,2.6,47.0,0.73,33.0,0.0,0.0,0.039,316.0,34.0,"Broccoli, raw",6408,"Dark green vegetables, excludes lettuce",1,Vegetable
73101010,0.93,0.24,9.58,4.74,2.8,33.0,0.3,69.0,0.0,0.0,0.037,320.0,41.0,"Carrots, raw",6404,Carrots,1,Vegetable
73102213,0.64,0.19,5.54,2.48,1.5,25.0,0.64,242.0,0.0,0.0,0.036,179.0,25.0,"Carrots, cooked, from canned, fat not added in cooking",6404,Carrots,3,Vegetable
73302010,0.95,0.13,8.59,2.2,1.5,28.0,0.58,4.0,0.0,0.0,0.027,350.0,34.0,"Squash, winter type, raw",6406,Other red and orange vegetables,1,Vegetable
73407000,0.98,0.2,20.93,15.4,2.5,15.0,0.8,44.0,0.0,0.0,0.041,185.0,89.0,"Sweetpotato, canned, NS as to syrup",6406,Other red and orange vegetables,3,Vegetable
73407020,0.98,0.2,20.93,15.4,2.5,15.0,0.8,44.0,0.0,0.0,0.041,185.0,89.0,"Sweetpotato, canned in syrup",6406,Other red and orange vegetables,3,Vegetable
73410210,2.94,32.35,56.82,8.82,8.8,59.0,2.12,35.0,0.0,0.0,2.941,925.0,532.0,"Sweet potato, chips",5004,"Tortilla, corn, other chips",4,Other
74101000,0.88,0.2,3.89,2.63,1.2,10.0,0.27,5.0,0.0,0.0,0.028,237.0,18.0,"Tomatoes, raw",6402,Tomatoes,1,Vegetable
74102000,1.2,0.2,5.1,4.0,1.1,13.0,0.51,13.0,0.0,0.0,0.028,204.0,23.0,"Tomatoes, green, raw",6420,Other vegetables and combinations,1,Vegetable
74201000,0.78,0.13,4.0,2.38,1.0,31.0,0.97,143.0,0.0,0.0,0.018,188.0,17.0,"Tomatoes, cooked, NS as to form, NS as to method",6402,Tomatoes,3,Vegetable
74201003,0.78,0.13,4.0,2.38,1.0,31.0,0.97,143.0,0.0,0.0,0.018,188.0,17.0,"Tomatoes, cooked, from canned, NS as to method",6402,Tomatoes,3,Vegetable
74204010,0.91,0.19,6.19,3.52,1.0,34.0,1.33,221.0,0.0,0.0,0.026,207.0,26.0,"Tomatoes, NS as to form, stewed",6402,Tomatoes,4,Vegetable
74204013,0.91,0.19,6.19,3.52,1.0,34.0,1.33,221.0,0.0,0.0,0.026,207.0,26.0,"Tomatoes, from canned, stewed",6402,Tomatoes,4,Vegetable
74301100,0.76,0.05,4.24,3.56,0.4,10.0,0.43,269.0,0.0,0.0,0.008,229.0,17.0,Tomato juice,7008,Vegetable juice,3,Other
74302000,0.63,0.09,4.55,3.3,0.8,11.0,0.42,198.0,0.0,0.0,0.013,193.0,19.0,Tomato juice cocktail,7008,Vegetable juice,3,Other
74303000,0.63,0.09,4.55,3.3,0.8,11.0,0.42,198.0,0.0,0.0,0.013,193.0,19.0,"Tomato and vegetable juice, mostly tomato",7008,Vegetable juice,3,Other
74401010,1.74,0.31,25.15,22.77,0.3,18.0,0.51,1114.0,0.0,0.0,0.043,382.0,97.0,Tomato catsup,8402,Tomato-based condiments,4,Other
74401110,1.74,0.31,25.15,22.77,0.3,18.0,0.51,20.0,0.0,0.0,0.043,382.0,97.0,"Tomato catsup, low sodium",8402,Tomato-based condiments,4,Other
74402010,2.5,0.3,19.79,10.54,5.9,20.0,0.8,1338.0,0.0,0.0,0.045,370.0,104.0,Tomato chili sauce (catsup-type),8402,Tomato-based condiments,4,Other
74402100,1.54,0.16,6.26,3.06,1.6,27.0,0.46,600.0,0.0,0.0,0.03,297.0,27.0,"Salsa, NFS",8402,Tomato-based condiments,4,Other
74402150,1.54,0.16,6.26,3.06,1.6,27.0,0.46,600.0,0.0,0.0,0.03,297.0,27.0,"Salsa, red, cooked, not homemade",8402,Tomato-based condiments,4,Other
74402350,1.13,0.89,6.36,3.5,1.9,9.0,0.65,600.0,0.0,0.0,0.0,259.0,38.0,"Green tomato-chile sauce, cooked (Salsa verde, NFS)",8412,"Dips, gravies, other sauces",4,Other
74403010,1.41,1.48,7.53,5.5,1.8,27.0,0.78,419.0,0.0,2.0,0.17,319.0,49.0,Tomato sauce,8410,"Pasta sauces, tomato-based",4,Other
74403050,1.41,1.48,8.06,5.5,1.8,27.0,0.78,30.0,0.0,2.0,0.17,319.0,51.0,"Tomato sauce, low sodium",8410,"Pasta sauces, tomato-based",4,Other
74404010,1.41,1.48,7.53,5.5,1.8,27.0,0.78,419.0,0.0,2.0,0.17,319.0,49.0,"Spaghetti sauce, meatless",8410,"Pasta sauces, tomato-based",4,Other
74404050,1.41,1.48,8.06,5.5,1.8,27.0,0.78,30.0,0.0,2.0,0.17,319.0,51.0,"Spaghetti sauce, meatless, low sodium",8410,"Pasta sauces, tomato-based",4,Other
74404060,0.94,0.74,8.77,7.36,1.4,13.0,0.76,546.0,0.0,0.0,0.133,398.0,41.0,"Spaghetti sauce, meatless, fat free",8410,"Pasta sauces, tomato-based",3,Other
74406010,0.0,0.29,36.25,26.06,0.6,12.0,0.21,847.0,0.0,0.0,0.0,208.0,150.0,Barbecue sauce,8402,Tomato-based condiments,4,Other
74406050,0.0,0.29,36.25,26.06,0.6,12.0,0.21,133.0,0.0,0.0,0.0,208.0,150.0,"Barbecue sauce, low sodium",8402,Tomato-based condiments,4,Other
74406100,1.25,0.23,22.04,9.82,1.5,19.0,1.37,1647.0,0.0,0.0,0.0,312.0,95.0,"Steak sauce, tomato-base",8402,Tomato-based condiments,4,Other
74406500,1.36,1.05,28.22,11.83,1.8,26.0,0.83,983.0,0.0,0.0,0.0,309.0,124.0,Cocktail sauce,8402,Tomato-based condiments,4,Other
74602030,1.46,0.44,15.22,8.23,1.1,13.0,0.59,377.0,0.0,0.0,0.115,562.0,66.0,"Tomato soup, canned, undiluted",3802,Soups,4,Other
74602050,0.93,0.61,7.17,3.9,0.4,29.0,0.18,356.0,0.0,2.0,0.286,111.0,38.0,"Tomato soup, instant type, prepared with water",3802,Soups,4,Other
74602100,0.79,0.28,6.57,3.97,0.6,8.0,0.54,33.0,0.0,0.0,0.076,112.0,30.0,"Tomato soup, canned, low sodium, ready-to-serve",3802,Soups,4,Other
74603010,1.78,1.71,8.44,0.73,0.6,9.0,0.45,367.0,0.0,2.0,0.635,88.0,56.0,"Tomato beef soup, prepared with water",3802,Soups,4,Other
74604010,1.78,1.71,8.44,0.73,0.6,9.0,0.45,367.0,0.0,2.0,0.635,88.0,56.0,"Tomato beef noodle soup, prepared with water",3802,Soups,4,Other
74605000,1.64,2.12,17.08,5.9,1.3,18.0,0.62,635.0,0.0,1.0,0.4,257.0,93.0,"Tomato rice soup, canned, undiluted",3802,Soups,4,Other
74605010,0.82,1.06,8.54,2.95,0.7,11.0,0.31,319.0,0.0,1.0,0.2,129.0,47.0,"Tomato rice soup, prepared with water",3802,Soups,4,Other
74606020,0.86,0.79,4.89,1.57,0.3,10.0,0.44,338.0,0.0,0.0,0.12,86.0,28.0,"Tomato vegetable soup with noodles, prepared with water",3802,Soups,4,Other
75100500,3.99,0.69,2.1,0.18,1.9,32.0,0.96,6.0,0.0,0.0,0.069,79.0,23.0,"Alfalfa sprouts, raw",6420,Other vegetables and combinations,1,Vegetable
75100750,2.0,0.01,17.44,9.6,1.6,14.0,3.4,4.0,0.0,0.0,0.0,429.0,73.0,"Artichoke, Jerusalem, raw",6420,Other vegetables and combinations,1,Vegetable
75100800,2.2,0.12,3.88,1.88,2.1,24.0,2.14,2.0,0.0,0.0,0.04,202.0,20.0,"Asparagus, raw",6420,Other vegetables and combinations,1,Vegetable
75101000,3.04,0.18,5.94,4.13,1.8,13.0,0.91,6.0,0.0,0.0,0.046,149.0,30.0,"Bean sprouts, raw (soybean or mung)",6420,Other vegetables and combinations,1,Vegetable
75101800,1.83,0.22,6.97,3.26,2.7,37.0,1.03,6.0,0.0,0.0,0.05,211.0,31.0,"Beans, string, green, raw",6412,String beans,1,Vegetable
75102000,6.84,0.86,20.17,1.48,4.9,34.0,3.14,8.0,0.0,0.0,0.198,467.0,113.0,"Beans, lima, raw",6418,Other starchy vegetables,1,Vegetable
75102500,1.61,0.17,9.56,6.76,2.8,16.0,0.8,78.0,0.0,0.0,0.027,325.0,43.0,"Beets, raw",6420,Other vegetables and combinations,1,Vegetable
75102600,2.95,0.3,6.09,3.03,3.2,33.0,0.73,23.0,0.0,0.0,0.047,300.0,31.0,"Broccoflower, raw",6420,Other vegetables and combinations,1,Vegetable
75102750,3.38,0.3,8.95,2.2,3.8,42.0,1.4,25.0,0.0,0.0,0.062,389.0,43.0,"Brussels sprouts, raw",6420,Other vegetables and combinations,1,Vegetable
75103000,1.28,0.1,5.8,3.2,2.5,40.0,0.47,18.0,0.0,0.0,0.034,170.0,25.0,"Cabbage, green, raw",6420,Other vegetables and combinations,1,Vegetable
75104000,1.5,0.2,2.18,1.18,1.0,105.0,0.8,65.0,0.0,0.0,0.027,252.0,13.0,"Cabbage, Chinese, raw",6420,Other vegetables and combinations,1,Vegetable
75105000,1.43,0.16,7.37,3.83,2.1,45.0,0.8,27.0,0.0,0.0,0.021,243.0,31.0,"Cabbage, red, raw",6420,Other vegetables and combinations,1,Vegetable
75105500,1.32,0.09,3.33,1.15,2.2,164.0,0.59,21.0,0.0,0.0,0.016,257.0,16.0,"Cactus, raw",6420,Other vegetables and combinations,1,Vegetable
75107000,1.92,0.28,4.97,1.91,2.0,22.0,0.42,30.0,0.0,0.0,0.064,299.0,25.0,"Cauliflower, raw",6420,Other vegetables and combinations,1,Vegetable
75109000,0.69,0.17,2.97,1.83,1.6,40.0,0.2,80.0,0.0,0.0,0.042,260.0,16.0,"Celery, raw",6420,Other vegetables and combinations,1,Vegetable
75109010,0.69,0.17,2.97,1.83,1.6,40.0,0.2,80.0,0.0,0.0,0.042,260.0,16.0,"Fennel bulb, raw",6420,Other vegetables and combinations,1,Vegetable
75109500,3.27,0.73,4.35,1.85,2.5,92.0,1.6,3.0,0.0,0.0,0.146,296.0,30.0,"Chives, raw",9999,Not included in a food category,1,Vegetable
75109550,2.13,0.52,3.67,0.87,2.8,67.0,1.77,46.0,0.0,0.0,0.014,521.0,23.0,"Cilantro, raw",9999,Not included in a food category,1,Vegetable
75109600,3.27,1.35,18.7,6.26,2.0,2.0,0.52,15.0,0.0,0.0,0.325,270.0,86.0,"Corn, raw",6416,Corn,1,Vegetable
75111000,0.59,0.16,2.16,1.38,0.7,14.0,0.22,2.0,0.0,0.0,0.013,136.0,12.0,"Cucumber, raw",6420,Other vegetables and combinations,1,Vegetable
75111200,1.01,0.19,5.7,2.35,3.4,9.0,0.24,2.0,0.0,0.0,0.034,230.0,24.0,"Eggplant, raw",6420,Other vegetables and combinations,1,Vegetable
75111500,6.36,0.5,33.06,1.0,2.1,181.0,1.7,17.0,0.0,0.0,0.089,401.0,149.0,"Garlic, raw",8406,Mustard and other condiments,1,Vegetable
75111800,0.72,0.09,8.82,1.8,4.9,12.0,0.6,4.0,0.0,0.0,0.021,150.0,38.0,"Jicama, raw",6420,Other vegetables and combinations,1,Vegetable
75112000,1.7,0.1,6.2,2.6,3.6,24.0,0.4,20.0,0.0,0.0,0.013,350.0,27.0,"Kohlrabi, raw",6420,Other vegetables and combinations,1,Vegetable
75112500,1.5,0.3,14.15,3.9,1.8,59.0,2.1,20.0,0.0,0.0,0.04,180.0,61.0,"Leek, raw",6414,Onions,1,Vegetable
75113000,0.9,0.14,2.97,1.97,1.2,18.0,0.41,10.0,0.0,0.0,0.018,141.0,14.0,"Lettuce, raw",6410,Lettuce and lettuce salads,1,Vegetable
75113060,1.35,0.22,2.23,0.94,1.1,35.0,1.24,5.0,0.0,0.0,0.029,238.0,13.0,"Lettuce, Boston, raw",6410,Lettuce and lettuce salads,1,Vegetable
75113080,2.58,0.66,3.65,2.05,1.6,160.0,1.46,27.0,0.0,0.0,0.086,369.0,25.0,"Lettuce, arugula, raw",6410,Lettuce and lettuce salads,1,Vegetable
75115000,3.09,0.34,3.26,1.98,1.0,3.0,0.5,5.0,0.2,0.0,0.05,318.0,22.0,"Mushrooms, raw",6420,Other vegetables and combinations,1,Vegetable
75117010,1.83,0.19,7.34,2.33,2.6,72.0,1.48,16.0,0.0,0.0,0.032,276.0,32.0,"Onions, young green, raw",6414,Onions,1,Vegetable
75117020,1.1,0.1,9.34,4.24,1.7,23.0,0.21,4.0,0.0,0.0,0.042,146.0,40.0,"Onions, mature, raw",6414,Onions,1,Vegetable
75119000,2.97,0.79,6.33,0.85,3.3,138.0,6.2,56.0,0.0,0.0,0.132,554.0,36.0,"Parsley, raw",9999,Not included in a food category,1,Vegetable
75120000,5.42,0.4,14.45,5.67,5.1,25.0,1.47,5.0,0.0,0.0,0.071,244.0,81.0,"Peas, green, raw",6418,Other starchy vegetables,1,Vegetable
75121400,0.86,0.17,4.64,2.4,1.7,10.0,0.34,3.0,0.0,0.0,0.058,175.0,20.0,"Pepper, poblano, raw",6420,Other vegetables and combinations,1,Vegetable
75121500,1.74,0.44,6.7,3.83,3.7,11.0,0.86,10.0,0.0,0.0,0.059,305.0,32.0,"Pepper, Serrano, raw",6420,Other vegetables and combinations,1,Vegetable
75122000,0.86,0.17,4.64,2.4,1.7,10.0,0.34,3.0,0.0,0.0,0.058,175.0,20.0,"Pepper, raw, NFS",6420,Other vegetables and combinations,1,Vegetable
75122100,0.86,0.17,4.64,2.4,1.7,10.0,0.34,3.0,0.0,0.0,0.058,175.0,20.0,"Pepper, sweet, green, raw",6420,Other vegetables and combinations,1,Vegetable
75122200,0.99,0.3,6.03,4.2,2.1,7.0,0.43,4.0,0.0,0.0,0.027,211.0,31.0,"Pepper, sweet, red, raw",6406,Other red and orange vegetables,1,Vegetable
75124000,1.66,0.45,5.35,1.95,3.4,14.0,0.46,13.0,0.0,0.0,0.048,256.0,27.0,"Pepper, banana, raw",6420,Other vegetables and combinations,1,Vegetable
75125000,0.68,0.1,3.4,1.86,1.6,25.0,0.34,39.0,0.0,0.0,0.032,233.0,16.0,"Radish, raw",6420,Other vegetables and combinations,1,Vegetable
75127000,1.2,0.2,8.13,5.6,2.5,47.0,0.52,20.0,0.0,0.0,0.027,337.0,36.0,"Rutabaga, raw",6420,Other vegetables and combinations,1,Vegetable
75127750,2.8,0.2,7.55,4.0,2.6,43.0,2.08,4.0,0.0,0.0,0.039,200.0,42.0,"Snowpeas (pea pod), raw",6420,Other vegetables and combinations,1,Vegetable
75128000,1.21,0.18,3.35,2.2,1.1,15.0,0.35,2.0,0.0,0.0,0.044,262.0,16.0,"Squash, summer, yellow, raw",6420,Other vegetables and combinations,1,Vegetable
75128010,1.21,0.32,3.11,2.5,1.0,16.0,0.37,8.0,0.0,0.0,0.084,261.0,17.0,"Squash, summer, green, raw",6420,Other vegetables and combinations,1,Vegetable
75129000,0.9,0.1,6.43,3.8,1.8,30.0,0.3,67.0,0.0,0.0,0.011,191.0,28.0,"Turnip, raw",6420,Other vegetables and combinations,1,Vegetable
75201030,2.65,8.57,10.96,0.91,7.9,19.0,0.61,55.0,0.0,0.0,1.214,262.0,122.0,Artichoke salad in oil,6422,Vegetable mixed dishes,3,Vegetable
75202013,2.14,0.65,2.46,1.06,1.6,16.0,1.83,287.0,0.0,0.0,0.147,172.0,19.0,"Asparagus, cooked, from canned, fat not added in cooking",6420,Other vegetables and combinations,3,Vegetable
75206013,1.15,0.1,4.5,0.96,1.3,26.0,0.9,251.0,0.0,0.0,0.022,109.0,20.0,"Beans, string, yellow, cooked, from canned, fat not added in cooking",6412,String beans,3,Vegetable
75208013,0.91,0.14,7.21,5.51,1.8,15.0,1.82,194.0,0.0,0.0,0.022,148.0,31.0,"Beets, cooked, from canned, fat not added in cooking",6420,Other vegetables and combinations,3,Vegetable
75216013,2.46,1.11,17.77,3.04,1.9,4.0,0.55,186.0,0.0,0.0,0.161,138.0,79.0,"Corn, cooked, from canned, NS as to color, fat not added in cooking",6416,Corn,3,Vegetable
75216050,1.74,0.42,18.13,3.23,1.2,3.0,0.38,285.0,0.0,0.0,0.065,134.0,72.0,"Corn, NS as to form, NS as to color, cream style",6416,Corn,4,Vegetable
75216113,2.46,1.11,17.77,3.04,1.9,4.0,0.55,186.0,0.0,0.0,0.161,138.0,79.0,"Corn, yellow, cooked, from canned, fat not added in cooking",6416,Corn,3,Vegetable
75216150,1.74,0.42,18.13,3.23,1.2,3.0,0.38,285.0,0.0,0.0,0.065,134.0,72.0,"Corn, yellow, NS as to form, cream style",6416,Corn,4,Vegetable
75216153,1.74,0.42,18.13,3.23,1.2,3.0,0.38,285.0,0.0,0.0,0.065,134.0,72.0,"Corn, yellow, from canned, cream style",6416,Corn,4,Vegetable
75216213,2.62,1.0,18.59,2.4,2.0,5.0,0.86,323.0,0.0,0.0,0.154,195.0,81.0,"Corn, white, cooked, from canned, fat not added in cooking",6416,Corn,3,Vegetable
75216250,1.74,0.42,18.13,2.21,1.2,3.0,0.38,285.0,0.0,0.0,0.065,134.0,72.0,"Corn, white, NS as to form, cream style",6416,Corn,4,Vegetable
75216253,1.74,0.42,18.13,2.21,1.2,3.0,0.38,285.0,0.0,0.0,0.065,134.0,72.0,"Corn, white, from canned, cream style",6416,Corn,4,Vegetable
75217500,1.48,0.88,14.26,1.82,2.5,10.0,0.62,210.0,0.0,0.0,0.123,9.0,72.0,"Hominy, cooked, fat not added in cooking",4804,Grits and other cooked cereals,3,Other
75219013,1.87,0.29,5.09,2.34,2.4,11.0,0.79,425.0,0.2,0.0,0.038,129.0,25.0,"Mushrooms, cooked, from canned, fat not added in cooking",6420,Other vegetables and combinations,3,Vegetable
75224023,4.47,0.8,11.36,2.99,4.9,23.0,1.18,273.0,0.0,0.0,0.143,106.0,68.0,"Peas, green, cooked, from canned, fat not added in cooking",6418,Other starchy vegetables,3,Vegetable
75226700,1.35,0.37,6.24,3.32,2.3,7.0,2.06,17.0,0.0,0.0,0.055,193.0,28.0,Pimiento,8406,Mustard and other condiments,3,Other
75235000,0.88,0.06,12.3,2.46,2.5,4.0,0.87,8.0,0.0,0.0,0.016,118.0,50.0,Water chestnut,6418,Other starchy vegetables,1,Vegetable
75236000,40.44,7.61,41.22,0.0,26.9,30.0,2.17,51.0,0.0,0.0,1.001,955.0,325.0,Yeast,9999,Not included in a food category,2,Other
75236500,23.88,0.9,20.42,1.6,6.5,67.0,4.04,2962.0,0.0,0.0,0.0,2100.0,185.0,Yeast extract spread,8406,Mustard and other condiments,4,Other
75340160,3.17,4.83,12.82,2.91,2.3,40.0,0.74,379.0,0.1,1.0,1.04,175.0,103.0,"Vegetable and pasta combinations with cream or cheese sauce (broccoli, pasta, carrots, corn, zucchini, peppers, cauliflower, peas, etc.), cooked",6422,Vegetable mixed dishes,4,Vegetable
75365000,20.29,11.05,56.15,22.48,19.0,259.0,6.18,511.0,0.0,0.0,1.446,1690.0,376.0,"Vegetable mixture, dried",9999,Not included in a food category,4,Vegetable
75415022,7.08,19.73,31.39,4.71,1.5,99.0,1.89,479.0,0.2,41.0,3.724,209.0,331.0,"Onion rings, from frozen, batter-dipped, baked or fried",6414,Onions,4,Vegetable
75500110,1.58,0.19,6.09,2.84,2.3,33.0,0.91,257.0,0.0,0.0,0.043,187.0,28.0,"Beans, string, green, pickled",8408,"Olives, pickles, pickled vegetables",3,Other
75500210,0.8,0.08,16.28,13.59,2.6,11.0,0.41,264.0,0.0,0.0,0.013,148.0,65.0,"Beets, pickled",8408,"Olives, pickles, pickled vegetables",3,Other
75500510,0.61,0.15,2.69,1.64,1.4,34.0,0.19,256.0,0.0,0.0,0.037,212.0,16.0,"Celery, pickled",8408,"Olives, pickles, pickled vegetables",3,Other
75501010,1.72,0.55,19.02,9.98,1.6,14.0,0.41,378.0,0.0,0.0,0.075,186.0,84.0,Corn relish,8408,"Olives, pickles, pickled vegetables",3,Other
75502500,1.6,0.1,5.67,1.3,3.1,48.0,0.49,277.0,0.0,0.0,0.013,853.0,30.0,"Cabbage, fresh, pickled, Japanese style",8408,"Olives, pickles, pickled vegetables",3,Other
75502510,0.61,0.08,37.38,35.25,0.8,48.0,0.56,21.0,0.0,0.0,0.014,147.0,152.0,"Cabbage, red, pickled",8408,"Olives, pickles, pickled vegetables",3,Other
75502520,1.57,0.23,3.96,1.43,1.2,91.0,0.82,624.0,0.0,0.0,0.032,245.0,21.0,"Cabbage, Kimchi (Kim Chee) style",8408,"Olives, pickles, pickled vegetables",3,Other
75503010,0.6,0.14,2.59,1.31,1.1,42.0,0.37,875.0,0.0,0.0,0.036,92.0,12.0,"Cucumber pickles, dill",8408,"Olives, pickles, pickled vegetables",4,Other
75503020,0.37,0.47,35.06,29.13,1.1,3.0,0.87,811.0,0.0,0.0,0.054,25.0,130.0,"Cucumber pickles, relish",8408,"Olives, pickles, pickled vegetables",4,Other
75503030,0.33,0.2,2.26,1.06,1.2,0.0,0.4,1208.0,0.0,0.0,0.052,23.0,11.0,"Cucumber pickles, sour",8408,"Olives, pickles, pickled vegetables",3,Other
75503040,0.58,0.41,21.15,18.27,1.0,61.0,0.25,457.0,0.0,0.0,0.067,100.0,91.0,"Cucumber pickles, sweet",8408,"Olives, pickles, pickled vegetables",3,Other
75503080,0.9,0.7,9.77,4.8,2.5,25.0,0.77,1674.0,0.0,0.0,0.14,12.0,49.0,"Eggplant, pickled",8408,"Olives, pickles, pickled vegetables",3,Other
75503090,1.18,0.69,11.29,7.99,3.3,56.0,0.42,314.0,0.0,0.0,0.09,246.0,48.0,Horseradish,8406,Mustard and other condiments,4,Vegetable
