53301000,1.9,11.0,34.0,15.65,1.6,11.0,0.45,201.0,0.0,0.0,3.797,65.0,237.0,"Pie, apple, two crust",5502,Cakes and pies,4,Other
53301070,3.0,16.1,42.6,21.4,2.6,22.0,1.22,374.0,0.0,0.0,2.457,65.0,316.0,"Pie, apple, individual size or tart",5502,Cakes and pies,4,Other
53301080,3.0,16.1,42.6,21.4,2.6,22.0,1.22,374.0,0.0,0.0,2.457,65.0,316.0,"Pie, apple, fried pie",5502,Cakes and pies,4,Other
53301750,2.13,5.33,44.71,26.64,2.1,6.0,1.0,288.0,0.0,0.0,1.333,71.0,227.0,"Pie, apple, diet",5502,Cakes and pies,4,Other
53302070,3.0,16.1,42.6,21.4,2.6,22.0,1.22,374.0,0.0,0.0,2.457,65.0,316.0,"Pie, apricot, individual size or tart",5502,Cakes and pies,4,Other
53304000,1.8,10.0,34.9,9.89,1.0,8.0,0.3,219.0,0.0,0.0,1.679,50.0,232.0,"Pie, blueberry, two crust",5502,Cakes and pies,4,Other
53305000,2.0,11.0,39.8,14.29,0.8,12.0,0.48,246.0,0.0,0.0,2.562,81.0,260.0,"Pie, cherry, two crust",5502,Cakes and pies,4,Other
53305070,2.0,11.0,39.8,14.29,0.8,12.0,0.48,246.0,0.0,0.0,2.562,81.0,260.0,"Pie, cherry, individual size or tart",5502,Cakes and pies,4,Other
53306000,2.6,10.8,48.0,28.31,2.6,22.0,1.49,254.0,0.0,0.0,2.682,203.0,289.0,"Pie, mince, two crust",5502,Cakes and pies,4,Other
53307000,1.9,10.0,32.9,6.19,0.8,8.0,0.5,194.0,0.0,0.0,1.508,125.0,223.0,"Pie, peach, two crust",5502,Cakes and pies,4,Other
53341000,4.4,13.6,32.9,12.06,0.7,75.0,1.04,240.0,0.8,51.0,3.758,165.0,269.0,"Pie, banana cream",5502,Cakes and pies,4,Other
53343000,2.1,16.6,37.2,36.27,1.3,29.0,0.8,301.0,0.0,0.0,6.976,65.0,298.0,"Pie, coconut cream",5502,Cakes and pies,4,Other
53344000,5.5,11.6,20.8,11.58,1.6,80.0,0.58,150.0,0.8,33.0,2.349,106.0,210.0,"Pie, custard",5502,Cakes and pies,4,Other
53347000,3.9,9.75,34.83,18.88,1.8,64.0,0.9,338.0,0.1,26.0,1.988,167.0,243.0,"Pie, pumpkin",5502,Cakes and pies,4,Other
53365000,4.8,14.4,32.6,12.68,0.6,90.0,1.02,260.0,1.2,62.0,4.03,126.0,278.0,"Pie, vanilla cream",5502,Cakes and pies,4,Other
53381000,1.5,8.7,47.2,23.86,1.2,56.0,0.61,172.0,0.2,45.0,1.766,89.0,268.0,"Pie, lemon meringue",5502,Cakes and pies,4,Other
53381070,1.5,8.7,47.2,23.86,1.2,56.0,0.61,172.0,0.2,45.0,1.766,89.0,268.0,"Pie, lemon meringue, individual size or tart",5502,Cakes and pies,4,Other
53382000,4.74,20.48,46.01,35.08,1.5,98.0,1.34,180.0,0.5,10.0,9.651,190.0,383.0,"Pie, chocolate-marshmallow",5502,Cakes and pies,4,Other
53385000,4.5,16.69,59.61,25.18,2.1,22.0,0.93,158.0,0.1,42.0,2.654,99.0,407.0,"Pie, pecan",5502,Cakes and pies,4,Other
53385070,4.5,16.69,59.61,25.18,2.1,22.0,0.93,158.0,0.1,42.0,2.654,99.0,407.0,"Pie, pecan, individual size or tart",5502,Cakes and pies,4,Other
53386250,4.69,22.2,42.63,13.76,2.9,35.0,2.62,290.0,0.0,0.0,8.595,184.0,378.0,"Pie, pudding, chocolate, with chocolate coating, individual size",5502,Cakes and pies,4,Other
53386500,4.45,21.9,42.48,13.69,2.9,34.0,2.18,286.0,0.0,0.0,8.503,140.0,374.0,"Pie, pudding, flavors other than chocolate, with chocolate coating, individual size",5502,Cakes and pies,4,Other
53391000,6.5,28.59,56.24,4.23,3.3,21.0,2.8,467.0,0.0,0.0,9.277,114.0,508.0,Pie shell,5502,Cakes and pies,4,Other
53391100,5.1,24.83,64.3,18.13,1.9,29.0,2.6,330.0,0.0,0.0,4.999,113.0,501.0,"Pie shell, graham cracker",5502,Cakes and pies,4,Other
53391150,5.1,31.1,54.4,22.1,1.5,30.0,3.0,672.0,0.4,1.0,6.732,168.0,506.0,"Pie shell, chocolate wafer",5502,Cakes and pies,4,Other
53420100,6.7,15.5,22.9,9.49,0.4,66.0,1.17,341.0,1.0,134.0,3.679,115.0,258.0,"Cream puff, eclair, custard or cream filled, not iced",5506,"Doughnuts, sweet rolls, pastries",4,Other
53420200,4.41,18.52,37.43,22.05,0.9,35.0,0.95,265.0,0.3,66.0,7.055,68.0,334.0,"Cream puff, eclair, custard or cream filled, iced",5506,"Doughnuts, sweet rolls, pastries",4,Other
53440000,3.3,11.2,41.1,25.75,2.2,15.0,0.42,157.0,0.0,6.0,2.044,149.0,274.0,"Strudel, apple",5502,Cakes and pies,4,Other
53452400,7.4,38.5,45.7,0.75,1.5,10.0,2.6,253.0,0.0,0.0,5.502,62.0,558.0,"Pastry, puff",5506,"Doughnuts, sweet rolls, pastries",4,Other
53452500,7.56,16.86,61.02,16.32,2.6,108.0,3.2,646.0,0.0,0.0,3.445,148.0,426.0,"Pastry, mainly flour and water, fried",5506,"Doughnuts, sweet rolls, pastries",4,Other
53453150,3.76,22.56,50.44,22.56,1.8,49.0,1.81,258.0,0.0,0.0,5.068,66.0,415.0,"Empanada, Mexican turnover, fruit-filled",5502,Cakes and pies,4,Other
53500100,7.0,22.4,44.6,19.78,1.3,71.0,1.96,371.0,0.0,21.0,5.681,125.0,403.0,"Breakfast pastry, NFS",5506,"Doughnuts, sweet rolls, pastries",4,Other
53510000,7.0,22.4,44.6,19.78,1.3,71.0,1.96,371.0,0.0,21.0,5.681,125.0,403.0,"Danish pastry, plain or spice",5506,"Doughnuts, sweet rolls, pastries",4,Other
53510100,5.4,18.5,47.8,27.53,1.9,46.0,1.77,354.0,0.0,114.0,4.86,83.0,371.0,"Danish pastry, with fruit",5506,"Doughnuts, sweet rolls, pastries",4,Other
53510200,7.1,25.2,45.7,25.87,2.0,94.0,1.8,298.0,0.0,46.0,5.821,95.0,430.0,"Danish pastry, with nuts",5506,"Doughnuts, sweet rolls, pastries",4,Other
53511000,8.0,21.9,37.2,6.95,1.0,35.0,1.6,322.0,0.0,23.0,6.794,98.0,374.0,"Danish pastry, with cheese",5506,"Doughnuts, sweet rolls, pastries",4,Other
53511500,8.4,0.64,64.3,35.13,1.2,42.0,1.84,274.0,0.0,1.0,0.195,115.0,296.0,"Danish pastry, with cheese, fat free, cholesterol free",5506,"Doughnuts, sweet rolls, pastries",4,Other
53520000,6.04,21.32,48.14,17.9,1.8,36.0,3.38,436.0,0.0,20.0,6.284,106.0,408.0,"Doughnut, NS as to cake or yeast",5506,"Doughnuts, sweet rolls, pastries",4,Other
53520110,5.87,23.55,45.63,16.28,1.6,25.0,3.0,557.0,0.0,9.0,7.127,113.0,418.0,"Doughnut, cake type",5506,"Doughnuts, sweet rolls, pastries",4,Other
53520120,4.5,19.9,57.4,31.92,2.2,213.0,2.27,397.0,0.0,57.0,5.132,106.0,417.0,"Doughnut, chocolate, cake type",5506,"Doughnuts, sweet rolls, pastries",4,Other
53520140,4.93,25.25,51.33,26.65,1.9,24.0,4.0,326.0,0.0,19.0,13.47,201.0,452.0,"Doughnut, cake type, chocolate covered",5506,"Doughnuts, sweet rolls, pastries",4,Other
53520150,6.06,21.83,46.82,23.12,2.0,33.0,2.85,432.0,0.0,7.0,6.703,146.0,401.0,"Doughnut, cake type, chocolate covered, dipped in peanuts",5506,"Doughnuts, sweet rolls, pastries",4,Other
53520160,5.62,22.23,49.4,24.3,2.2,34.0,3.33,457.0,0.0,7.0,7.535,145.0,411.0,"Doughnut, chocolate, cake type, with chocolate icing",5506,"Doughnuts, sweet rolls, pastries",4,Other
53520700,3.1,18.3,59.5,35.11,1.2,26.0,2.42,345.0,0.0,11.0,4.667,78.0,412.0,French cruller,5506,"Doughnuts, sweet rolls, pastries",4,Other
53521100,5.88,17.15,55.96,30.27,3.6,46.0,4.14,232.0,0.0,21.0,5.789,232.0,383.0,"Doughnut, chocolate, raised or yeast, with chocolate icing",5506,"Doughnuts, sweet rolls, pastries",4,Other
53521110,6.21,19.1,50.64,19.52,2.1,46.0,3.75,316.0,0.0,30.0,5.44,100.0,399.0,"Doughnut, raised or yeast",5506,"Doughnuts, sweet rolls, pastries",4,Other
53521120,6.74,18.83,50.98,18.73,3.3,49.0,4.28,303.0,0.0,29.0,5.544,208.0,391.0,"Doughnut, chocolate, raised or yeast",5506,"Doughnuts, sweet rolls, pastries",4,Other
53521130,5.36,16.87,54.6,31.14,2.3,50.0,3.48,238.0,0.0,22.0,5.533,126.0,383.0,"Doughnut, raised or yeast, chocolate covered",5506,"Doughnuts, sweet rolls, pastries",4,Other
53521140,5.9,18.7,39.0,21.1,0.9,25.0,1.76,240.0,0.0,26.0,4.843,79.0,340.0,"Doughnut, jelly",5506,"Doughnuts, sweet rolls, pastries",4,Other
53521210,6.4,24.5,30.0,14.55,0.8,25.0,1.83,309.0,0.0,24.0,5.43,80.0,361.0,"Doughnut, custard-filled",5506,"Doughnuts, sweet rolls, pastries",4,Other
53521220,5.53,15.56,43.76,17.84,1.8,59.0,2.99,268.0,0.2,25.0,4.635,111.0,337.0,"Doughnut, chocolate cream-filled",5506,"Doughnuts, sweet rolls, pastries",4,Other
53521230,4.15,11.82,57.13,38.32,1.3,44.0,2.24,214.0,0.2,19.0,3.503,80.0,348.0,"Doughnut, custard-filled, with icing",5506,"Doughnuts, sweet rolls, pastries",4,Other
53521250,6.3,19.3,42.6,21.58,2.2,49.0,1.1,427.0,0.0,20.0,3.023,148.0,360.0,"Doughnut, wheat",5506,"Doughnuts, sweet rolls, pastries",4,Other
53530000,4.34,10.2,70.42,33.79,0.8,11.0,4.0,318.0,0.0,0.0,2.658,72.0,391.0,Breakfast tart,5506,"Doughnuts, sweet rolls, pastries",4,Other
53530010,3.99,5.99,76.8,4.87,1.5,44.0,3.42,301.0,0.0,0.0,1.393,66.0,372.0,"Breakfast tart, lowfat",5506,"Doughnuts, sweet rolls, pastries",4,Other
53540000,7.1,12.55,69.8,31.31,2.6,50.0,4.02,209.0,0.0,0.0,7.095,262.0,420.0,"Breakfast bar, NFS",5402,Cereal bars,4,Other
53540200,4.4,7.5,72.9,35.1,2.1,41.0,4.86,167.0,0.0,0.0,1.5,197.0,377.0,"Breakfast bar, cereal crust with fruit filling, lowfat",5402,Cereal bars,4,Other
53540300,5.0,10.0,69.78,25.0,22.5,250.0,0.9,225.0,0.0,0.0,3.397,447.0,350.0,Fiber One Chewy Bar,5402,Cereal bars,4,Other
53540400,5.41,8.11,70.33,32.43,3.6,541.0,4.86,283.0,0.8,1.0,1.215,250.0,376.0,Kellogg's Nutri-Grain Cereal Bar,5402,Cereal bars,4,Other
53540402,5.41,8.11,70.33,32.43,3.6,541.0,4.86,283.0,0.8,1.0,1.215,250.0,376.0,Kellogg's Nutri-Grain Yogurt Bar,5402,Cereal bars,4,Other
53540404,9.38,10.93,66.72,32.45,7.5,65.0,5.65,195.0,0.8,0.0,1.93,328.0,403.0,Kellogg's Nutri-Grain Fruit and Nut Bar,5402,Cereal bars,4,Other
53540500,7.07,11.6,60.86,31.1,15.0,49.0,2.22,11.0,0.0,0.0,2.032,441.0,336.0,"Breakfast bar, date, with yogurt coating",5402,Cereal bars,4,Other
53540600,6.47,10.98,72.05,45.97,0.4,410.0,5.99,319.0,1.7,6.0,9.114,254.0,413.0,Milk 'n Cereal bar,5402,Cereal bars,4,Other
53540700,9.09,9.09,72.73,31.8,1.8,31.0,2.56,500.0,0.0,0.0,0.0,143.0,409.0,Kellogg's Special K bar,5402,Cereal bars,4,Other
53540800,16.67,7.69,63.42,42.31,7.7,103.0,1.62,321.0,0.2,6.0,3.227,429.0,390.0,Kashi GOLEAN Chewy Bars,5404,Nutrition bars,4,Other
53540802,18.57,15.71,53.26,17.14,11.4,0.0,3.39,293.0,0.0,0.0,1.213,415.0,429.0,Kashi TLC Chewy Granola Bar,5404,Nutrition bars,4,Other
53540804,17.88,9.23,59.58,27.3,5.9,434.0,5.2,486.0,0.0,0.0,4.687,300.0,393.0,Kashi GOLEAN Crunchy Bars,5404,Nutrition bars,4,Other
53540806,15.0,15.0,62.78,20.0,10.0,0.0,2.7,400.0,0.0,0.0,1.436,545.0,446.0,Kashi TLC Crunchy Granola Bar,5404,Nutrition bars,4,Other
53540900,5.71,11.43,72.27,42.86,3.8,116.0,8.71,286.0,0.0,0.0,2.857,189.0,415.0,Nature Valley Chewy Trail Mix Granola Bar,5402,Cereal bars,4,Other
53540902,5.71,11.43,74.29,40.0,4.4,286.0,1.03,271.0,0.0,0.0,1.372,168.0,423.0,Nature Valley Chewy Granola Bar with Yogurt Coating,5402,Cereal bars,4,Other
53540904,9.14,22.86,61.14,33.14,2.9,57.0,1.44,414.0,0.0,0.0,6.857,390.0,487.0,Nature Valley Sweet and Salty Nut Granola Bar,5402,Cereal bars,4,Other
53540906,10.1,19.8,64.4,28.57,5.3,61.0,2.95,294.0,0.0,0.0,2.37,336.0,471.0,Nature Valley Crunchy Granola Bar,5402,Cereal bars,4,Other
53541000,5.65,16.57,70.2,28.92,3.8,41.0,2.19,179.0,0.0,0.0,6.061,237.0,418.0,Quaker Chewy Granola Bar,5402,Cereal bars,4,Other
53541002,4.17,8.33,79.17,29.17,4.2,333.0,1.5,313.0,0.0,1.0,2.083,224.0,408.0,Quaker Chewy 90 Calorie Granola Bar,5402,Cereal bars,4,Other
53541004,5.55,12.5,69.4,20.8,3.1,417.0,2.03,312.0,0.0,0.0,5.008,199.0,412.0,Quaker Chewy 25% Less Sugar Granola Bar,5402,Cereal bars,4,Other
53541006,7.52,20.42,64.96,37.61,3.2,65.0,1.16,269.0,0.1,0.0,8.693,231.0,480.0,Quaker Chewy Dipps Granola Bar,5402,Cereal bars,4,Other
53541200,7.0,13.37,71.43,31.1,7.1,536.0,9.64,294.0,5.4,0.0,8.548,357.0,420.0,Meal replacement bar,5404,Nutrition bars,4,Other
53541300,16.19,8.92,60.21,25.0,5.1,668.0,4.98,253.0,5.4,7.0,5.36,289.0,386.0,Slim Fast Original Meal Bar,5404,Nutrition bars,4,Other
53542000,6.67,6.67,75.47,31.54,4.6,333.0,6.0,367.0,0.1,36.0,1.299,238.0,389.0,"Snack bar, oatmeal",5402,Cereal bars,4,Other
53542100,9.8,17.6,66.7,27.52,3.1,60.0,3.18,251.0,0.0,0.0,12.69,326.0,464.0,"Granola bar, NFS",5402,Cereal bars,4,Other
53542200,7.7,6.3,77.42,43.5,5.3,36.0,5.3,251.0,0.0,0.0,0.73,238.0,397.0,"Granola bar, lowfat, NFS",5402,Cereal bars,4,Other
53542210,5.9,0.9,77.6,55.34,7.4,3.0,4.0,24.0,0.0,0.0,0.2,220.0,342.0,"Granola bar, nonfat",5402,Cereal bars,4,Other
53543000,5.55,12.5,69.4,20.8,3.1,417.0,2.03,312.0,0.0,0.0,5.008,199.0,412.0,"Granola bar, reduced sugar, NFS",5402,Cereal bars,4,Other
53543100,11.0,21.4,63.7,33.96,4.3,39.0,2.5,278.0,0.0,0.0,2.52,305.0,479.0,"Granola bar, peanuts, oats, sugar, wheat germ",5402,Cereal bars,4,Other
53544200,5.2,32.2,55.2,34.27,6.2,42.0,1.75,152.0,0.0,0.0,22.72,254.0,531.0,"Granola bar, chocolate-coated, NFS",5402,Cereal bars,4,Other
53544210,5.2,32.2,55.2,34.27,6.2,42.0,1.75,152.0,0.0,0.0,22.72,254.0,531.0,"Granola bar, with coconut, chocolate-coated",5402,Cereal bars,4,Other
53544220,9.6,31.2,54.1,23.63,3.8,108.0,1.45,193.0,0.0,12.0,17.065,339.0,536.0,"Granola bar with nuts, chocolate-coated",5402,Cereal bars,4,Other
53544230,8.6,20.0,60.13,34.0,4.3,136.0,1.49,486.0,0.0,3.0,5.668,320.0,455.0,"Granola bar, oats, nuts, coated with non-chocolate coating",5402,Cereal bars,4,Other
53544250,10.2,31.1,53.4,23.74,2.8,108.0,1.45,193.0,0.0,12.0,17.01,339.0,508.0,"Granola bar, coated with non-chocolate coating",5402,Cereal bars,4,Other
53544300,9.94,10.41,65.5,15.61,8.4,58.0,2.71,51.0,0.0,0.0,3.668,377.0,343.0,"Granola bar, high fiber, coated with non-chocolate yogurt coating",5402,Cereal bars,4,Other
53544400,6.75,16.92,65.26,21.36,3.5,27.0,9.9,352.0,1.0,0.0,5.435,188.0,426.0,"Granola bar, with rice cereal",5402,Cereal bars,4,Other
53544410,7.17,17.5,66.27,30.0,5.7,41.0,1.56,167.0,0.0,0.0,9.888,285.0,451.0,Quaker Granola Bites,5402,Cereal bars,4,Other
53544450,14.15,3.11,69.63,30.07,5.7,504.0,11.7,146.0,0.0,0.0,1.32,362.0,363.0,PowerBar (fortified high energy bar),5404,Nutrition bars,4,Other
53610120,3.5,2.3,75.72,45.42,2.7,126.0,1.66,342.0,0.0,0.0,0.562,59.0,324.0,"Coffee cake, crumb or quick-bread type, reduced fat, cholesterol free",5506,"Doughnuts, sweet rolls, pastries",4,Other
53801000,5.43,5.3,68.63,42.0,1.7,1053.0,13.16,250.0,0.0,1.0,0.453,180.0,344.0,"Cereal bar with fruit filling, baby food",9012,Baby food: snacks and sweets,4,Other
53803050,6.8,12.6,73.7,24.2,3.4,83.0,2.9,9.0,0.0,4.0,2.7,425.0,435.0,"Cookie, fruit, baby food",9012,Baby food: snacks and sweets,4,Other
53803100,11.8,13.2,67.1,24.2,0.2,101.0,4.18,357.0,1.2,12.0,2.352,501.0,433.0,"Cookie, baby food",9012,Baby food: snacks and sweets,4,Other
53803250,10.7,4.2,76.4,12.65,1.4,263.0,3.55,227.0,0.5,7.0,1.206,323.0,391.0,"Cookie, teething, baby",9012,Baby food: snacks and sweets,4,Other
54001000,6.6,25.83,61.37,7.45,2.1,95.0,3.81,865.0,0.0,0.0,5.4,111.0,504.0,"Crackers, NS as to sweet or nonsweet",5202,"Crackers, excludes saltines",4,Other
54101010,6.9,13.8,74.1,13.93,1.1,43.0,2.75,482.0,0.0,0.0,3.463,100.0,446.0,"Cracker, animal",5504,Cookies and brownies,4,Other
54102010,6.9,10.1,76.8,31.1,2.8,24.0,3.73,477.0,0.0,0.0,1.519,135.0,423.0,"Crackers, graham",5504,Cookies and brownies,4,Other
54102020,5.8,23.2,66.5,41.56,3.1,58.0,3.58,257.0,0.0,0.0,13.38,209.0,484.0,"Crackers, graham, chocolate covered",5504,Cookies and brownies,4,Other
54102050,6.86,17.45,70.57,17.76,2.8,36.0,3.27,554.0,0.0,0.0,4.071,242.0,465.0,"Crackers, oatmeal",5504,Cookies and brownies,4,Other
54102060,7.56,6.83,77.31,19.14,2.0,72.0,1.5,262.0,0.0,0.0,1.576,257.0,404.0,"Crackers, Cuban",5504,Cookies and brownies,4,Other
54102070,6.6,25.83,61.37,7.45,2.1,95.0,3.81,865.0,0.0,0.0,5.4,111.0,504.0,"Crackers, Cuca",5504,Cookies and brownies,4,Other
54102080,6.26,8.34,78.85,37.47,3.0,29.0,3.43,392.0,0.0,0.0,1.252,248.0,406.0,"Crackers, graham, with raisins",5504,Cookies and brownies,4,Other
54102100,6.91,4.97,80.3,22.16,2.6,89.0,5.13,676.0,0.0,0.0,1.185,117.0,392.0,"Crackers, graham, lowfat",5504,Cookies and brownies,4,Other
54102110,8.03,1.0,83.98,23.14,3.7,26.0,4.44,346.0,0.0,0.0,0.163,132.0,375.0,"Crackers, graham, fat free",5504,Cookies and brownies,4,Other
54102200,4.83,11.94,74.13,40.7,2.0,18.0,2.66,389.0,0.0,0.0,1.956,105.0,422.0,"Crackers, graham, sandwich-type, with filling",5504,Cookies and brownies,4,Other
54202010,9.5,8.85,74.34,2.22,2.9,119.0,5.13,198.0,0.0,0.0,2.001,724.0,421.0,"Crackers, saltine, low sodium",5204,Saltine crackers,4,Other
54202050,10.5,1.6,82.3,0.38,2.7,22.0,7.72,716.0,0.0,0.0,0.244,115.0,393.0,"Crackers, saltine, fat free, low sodium",5204,Saltine crackers,4,Other
54203010,8.6,20.6,64.9,13.04,4.5,49.0,4.4,190.0,0.0,0.0,5.178,203.0,473.0,"Crackers, toast thins (rye, wheat, white flour), low sodium",5202,"Crackers, excludes saltines",4,Other
54204010,8.8,17.2,68.6,0.37,10.5,50.0,3.08,186.0,0.0,0.0,3.393,297.0,443.0,"Cracker, 100% whole wheat, low sodium",5202,"Crackers, excludes saltines",4,Other
54205010,7.4,25.3,61.0,1.79,1.6,120.0,3.6,216.0,0.0,0.0,3.776,355.0,502.0,"Cracker, snack, low sodium",5202,"Crackers, excludes saltines",4,Other
54205030,10.1,25.3,58.2,0.28,2.4,151.0,4.77,458.0,0.0,13.0,9.638,106.0,503.0,"Cracker, cheese, low sodium",5202,"Crackers, excludes saltines",4,Other
54205100,7.1,13.29,75.37,20.53,2.9,96.0,4.79,292.0,0.0,0.0,2.203,131.0,446.0,"Cracker, snack, lowfat, low sodium",5202,"Crackers, excludes saltines",4,Other
54206010,8.2,2.8,81.5,0.88,4.2,11.0,1.49,26.0,0.0,0.0,0.57,290.0,387.0,Puffed rice cake without salt,5202,"Crackers, excludes saltines",1,Other
54207010,11.37,1.08,84.88,1.21,3.0,18.0,5.11,324.0,0.0,0.0,0.171,118.0,404.0,"Crispbread, wheat, low sodium",5202,"Crackers, excludes saltines",4,Other
54210010,8.36,18.82,63.58,12.42,2.9,92.0,3.33,73.0,0.0,0.0,3.361,162.0,454.0,"Cracker, multigrain, salt free",5202,"Crackers, excludes saltines",4,Other
54222000,7.9,1.3,82.2,1.07,16.5,31.0,2.43,453.0,0.0,0.0,0.145,319.0,366.0,"Crispbread, rye, low sodium",5202,"Crackers, excludes saltines",4,Other
54301000,6.6,25.83,61.37,7.45,2.1,95.0,3.81,865.0,0.0,0.0,5.4,111.0,504.0,"Cracker, snack",5202,"Crackers, excludes saltines",4,Other
54301100,7.9,3.0,81.72,7.61,1.6,150.0,7.18,1087.0,0.0,0.0,0.521,123.0,392.0,"Cracker, snack, reduced fat",5202,"Crackers, excludes saltines",4,Other
54301200,8.02,1.05,83.36,8.24,1.9,185.0,7.29,1017.0,0.0,0.0,0.15,117.0,381.0,"Cracker, snack, fat free",5202,"Crackers, excludes saltines",4,Other
54304000,10.93,22.74,59.42,4.53,2.3,136.0,4.88,973.0,0.0,3.0,5.288,156.0,489.0,"Cracker, cheese",5202,"Crackers, excludes saltines",4,Other
54304100,10.0,11.67,68.19,0.0,3.3,67.0,4.8,1167.0,0.0,0.0,3.333,141.0,418.0,"Cracker, cheese, reduced fat",5202,"Crackers, excludes saltines",4,Other
54304500,9.6,0.9,80.4,1.01,22.9,40.0,5.94,557.0,0.0,0.0,0.108,495.0,334.0,"Cracker, high fiber, no added fat",5202,"Crackers, excludes saltines",4,Other
54305000,11.33,1.08,84.63,1.21,3.0,18.0,5.1,514.0,0.0,0.0,0.17,118.0,403.0,"Crispbread, wheat, no added fat",5202,"Crackers, excludes saltines",4,Other
54305500,7.9,1.3,82.2,1.07,16.5,31.0,2.43,453.0,0.0,0.0,0.145,319.0,366.0,"Crispbread, wheat or rye, extra crispy",5202,"Crackers, excludes saltines",4,Other
54307000,10.0,1.4,83.7,0.29,3.0,13.0,3.16,0.0,0.0,0.0,0.226,112.0,395.0,"Crackers, matzo",5202,"Crackers, excludes saltines",4,Other
54308000,7.6,15.8,69.7,16.44,1.9,172.0,3.58,592.0,0.0,11.0,2.633,114.0,455.0,"Crackers, milk",5202,"Crackers, excludes saltines",4,Other
54313000,9.5,8.85,74.34,2.22,2.9,21.0,5.13,1116.0,0.0,0.0,2.001,159.0,421.0,"Crackers, oyster",5204,Saltine crackers,4,Other
54318500,7.1,4.3,81.1,0.88,4.2,11.0,1.49,71.0,0.0,0.0,0.875,428.0,392.0,"Rice cake, cracker-type",5202,"Crackers, excludes saltines",4,Other
54319000,6.63,5.61,74.35,0.11,1.2,27.0,0.76,780.0,0.0,0.0,0.822,107.0,384.0,"Crackers, rice",5202,"Crackers, excludes saltines",4,Other
54319010,8.2,2.8,81.5,0.88,4.2,11.0,1.49,326.0,0.0,0.0,0.57,290.0,387.0,Puffed rice cake,5202,"Crackers, excludes saltines",4,Other
54319020,9.7,3.1,80.1,0.72,2.9,9.0,1.87,288.0,0.0,0.0,0.48,327.0,384.0,Popcorn cake,5202,"Crackers, excludes saltines",4,Other
54319500,5.07,1.21,72.54,0.27,2.1,10.0,0.38,310.0,0.0,0.0,0.328,65.0,329.0,Rice paper,5202,"Crackers, excludes saltines",3,Other
54322000,7.9,1.3,82.2,1.07,16.5,31.0,2.43,453.0,0.0,0.0,0.145,319.0,366.0,"Crispbread, rye, no added fat",5202,"Crackers, excludes saltines",4,Other
54325000,9.5,8.85,74.34,2.22,2.9,21.0,5.13,1116.0,0.0,0.0,2.001,159.0,421.0,"Crackers, saltine",5204,Saltine crackers,4,Other
54325050,7.14,10.71,68.25,0.0,0.0,0.0,5.14,1214.0,0.0,0.0,0.0,221.0,398.0,"Crackers, saltine, whole wheat",5204,Saltine crackers,4,Other
54327950,15.64,31.4,48.22,5.63,4.7,58.0,4.04,774.0,0.0,2.0,5.136,334.0,523.0,"Crackers, cylindrical, peanut-butter filled",5202,"Crackers, excludes saltines",4,Other
54328000,12.41,25.12,56.74,6.98,3.4,50.0,2.72,913.0,0.0,0.0,4.406,218.0,496.0,"Crackers, sandwich-type, NFS",5202,"Crackers, excludes saltines",4,Other
54328100,11.47,24.54,58.38,10.5,2.3,81.0,2.77,901.0,0.0,0.0,4.913,215.0,494.0,"Cracker, sandwich-type, peanut butter filled",5202,"Crackers, excludes saltines",4,Other
54328110,15.87,17.22,57.43,7.05,3.5,25.0,3.19,592.0,0.0,0.0,2.647,334.0,438.0,"Cracker, sandwich-type, peanut butter filled, reduced fat",5202,"Crackers, excludes saltines",4,Other
54328200,9.3,21.1,61.7,3.18,1.9,257.0,2.39,888.0,0.0,2.0,6.125,429.0,477.0,"Cracker, sandwich-type, cheese-filled",5202,"Crackers, excludes saltines",4,Other
54334000,8.95,17.36,67.35,13.8,3.7,81.0,4.69,918.0,0.0,0.0,2.73,207.0,456.0,"Crackers, toast thins (rye, pumpernickel, white flour)",5202,"Crackers, excludes saltines",4,Other
54336000,10.22,10.4,71.71,0.26,2.8,15.0,4.36,746.0,0.0,0.0,2.5,110.0,427.0,"Crackers, water biscuits",5202,"Crackers, excludes saltines",4,Other
54337000,10.58,14.13,69.55,1.19,10.3,36.0,3.34,704.0,0.0,0.0,2.063,345.0,427.0,"Cracker, 100% whole wheat",5202,"Crackers, excludes saltines",4,Other
54337050,11.34,7.59,75.52,1.22,10.9,39.0,3.56,745.0,0.0,0.0,1.067,373.0,416.0,"Cracker, 100% whole wheat, reduced fat",5202,"Crackers, excludes saltines",4,Other
54337100,10.66,13.98,69.47,1.18,10.8,37.0,3.45,693.0,0.0,0.0,2.042,358.0,424.0,"Crackers, whole wheat and bran",5202,"Crackers, excludes saltines",4,Other
54338000,8.95,17.36,67.35,13.8,3.7,81.0,4.69,918.0,0.0,0.0,2.73,207.0,456.0,"Crackers, wheat",5202,"Crackers, excludes saltines",4,Other
54338100,9.34,13.37,71.52,15.01,3.4,80.0,5.02,866.0,0.0,0.0,2.112,210.0,444.0,"Crackers, wheat, reduced fat",5202,"Crackers, excludes saltines",4,Other
54339000,6.08,22.93,62.05,3.02,2.7,66.0,3.48,1100.0,0.0,0.0,5.697,101.0,481.0,"Crackers, corn",5202,"Crackers, excludes saltines",4,Other
54350000,8.4,19.6,66.85,13.0,4.0,41.0,4.2,571.0,0.0,0.0,1.966,245.0,477.0,"Crackers, baby food",9012,Baby food: snacks and sweets,4,Other
54350010,6.4,9.9,76.68,28.0,2.3,400.0,22.5,324.0,0.0,0.0,1.646,114.0,421.0,"Gerber Finger Foods, Puffs, baby food",9012,Baby food: snacks and sweets,4,Other
54401010,8.5,15.64,71.86,0.61,6.9,9.0,1.67,635.0,0.0,0.0,2.43,278.0,446.0,"Salty snacks, corn or cornmeal base, nuts or nuggets, toasted",5004,"Tortilla, corn, other chips",4,Other
54401020,6.03,28.41,63.01,1.16,5.3,164.0,1.32,545.0,0.0,0.0,3.612,135.0,518.0,"Salty snacks, corn or cornmeal base, corn chips, corn-cheese chips",5004,"Tortilla, corn, other chips",4,Other
54401050,5.83,37.11,52.38,2.87,1.9,58.0,1.75,910.0,0.0,7.0,5.658,189.0,565.0,"Salty snacks, corn or cornmeal base, corn puffs and twists; corn-cheese puffs and twists",5004,"Tortilla, corn, other chips",4,Other
54401080,7.26,23.05,66.22,1.1,5.0,138.0,1.83,363.0,0.0,0.0,2.814,212.0,494.0,"Salty snacks, corn or cornmeal base, tortilla chips",5004,"Tortilla, corn, other chips",4,Other
54401090,6.6,33.4,57.4,1.41,4.4,124.0,1.7,15.0,0.0,0.0,4.344,185.0,557.0,"Salty snacks, corn or cornmeal base, corn chips, corn-cheese chips, unsalted",5004,"Tortilla, corn, other chips",4,Other
54401100,8.7,15.2,73.4,0.53,5.7,159.0,1.63,856.0,0.0,3.0,2.837,272.0,465.0,"Salty snacks, corn or cornmeal base, tortilla chips, light (baked with less oil)",5004,"Tortilla, corn, other chips",4,Other
54401120,8.44,3.53,65.22,2.82,6.4,128.0,4.8,602.0,0.0,2.0,1.054,396.0,318.0,"Salty snacks, corn or cornmeal base, tortilla chips, fat free, made with Olean",5004,"Tortilla, corn, other chips",4,Other
54401150,11.0,5.7,80.0,0.67,5.3,159.0,1.6,419.0,0.0,0.0,0.85,272.0,415.0,"Salty snacks, corn or cornmeal base, tortilla chips, lowfat, baked without fat",5004,"Tortilla, corn, other chips",4,Other
54401170,11.0,5.7,80.1,0.85,5.3,159.0,1.6,15.0,0.0,0.0,0.85,272.0,416.0,"Salty snacks, corn or cornmeal base, tortilla chips, lowfat, baked without fat, unsalted",5004,"Tortilla, corn, other chips",4,Other
54401210,8.5,12.1,72.35,7.29,10.7,357.0,1.28,847.0,0.0,1.0,2.1,286.0,432.0,"Salty snacks, corn based puffs and twists, cheese puffs and twists, lowfat",5004,"Tortilla, corn, other chips",4,Other
54402080,7.79,23.36,65.32,1.0,5.3,174.0,2.32,15.0,0.0,0.0,2.458,215.0,503.0,"Salty snacks, corn or cornmeal base, tortilla chips, unsalted",5004,"Tortilla, corn, other chips",4,Other
54402200,7.19,25.4,63.03,2.04,3.7,101.0,2.44,802.0,0.0,2.0,3.559,172.0,502.0,"Salty snack mixture, mostly corn or cornmeal based, with pretzels, without nuts",5008,Pretzels/snack mix,4,Other
54402500,8.84,21.54,64.63,1.75,2.6,65.0,3.77,895.0,0.0,3.0,3.275,159.0,491.0,"Salty snacks, wheat- and corn-based chips",5004,"Tortilla, corn, other chips",4,Other
54402600,5.97,26.22,64.77,2.31,3.3,4.0,0.96,422.0,0.0,0.0,1.981,120.0,521.0,"Salty snacks, multigrain, chips",5004,"Tortilla, corn, other chips",4,Other
54402700,11.79,15.2,68.26,4.76,3.8,17.0,4.59,854.0,0.0,0.0,1.342,129.0,457.0,Pita chips,5202,"Crackers, excludes saltines",4,Other
54403000,7.29,43.55,45.06,0.46,8.1,4.0,1.98,1058.0,0.0,0.0,6.82,182.0,583.0,"Popcorn, popped in oil, unbuttered",5006,Popcorn,4,Other
54403010,12.94,4.54,77.9,0.87,14.5,7.0,3.19,8.0,0.0,0.0,0.57,329.0,387.0,"Popcorn, air-popped (no butter or no oil added)",5006,Popcorn,1,Other
54403020,8.69,29.98,55.7,0.54,9.9,20.0,2.36,771.0,0.0,0.0,6.604,219.0,528.0,"Popcorn, popped in oil, buttered",5006,Popcorn,4,Other
54403050,10.42,29.15,52.02,1.54,9.5,67.0,2.15,830.0,0.0,7.0,7.509,255.0,499.0,"Popcorn, flavored",5006,Popcorn,4,Other
54403060,10.72,6.1,76.04,0.65,13.6,14.0,2.87,627.0,0.0,0.0,1.184,284.0,402.0,"Popcorn, popped in oil, lowfat, low sodium",5006,Popcorn,4,Other
54403070,12.6,9.5,72.0,0.92,14.2,11.0,2.28,884.0,0.0,0.0,1.415,241.0,424.0,"Popcorn, popped in oil, lowfat",5006,Popcorn,4,Other
54403090,9.0,28.1,58.1,0.54,10.0,10.0,2.78,3.0,0.0,0.0,5.05,225.0,500.0,"Popcorn, popped in oil, unsalted",5006,Popcorn,4,Other
