25230110,12.59,32.16,2.33,0.0,0.0,9.0,0.86,1293.0,1.0,55.0,11.59,202.0,353.0,"Luncheon meat, NFS",2602,Cold cuts and cured meats,4,Other
25230210,16.47,3.61,0.59,1.04,0.0,5.0,0.57,1203.0,0.7,41.0,1.022,638.0,105.0,"Ham, sliced, prepackaged or deli, luncheon meat",2602,Cold cuts and cured meats,4,Other
25230220,22.0,7.7,0.5,0.0,0.0,8.0,1.4,969.0,0.8,57.0,2.624,362.0,165.0,"Ham, sliced, low salt, prepackaged or deli, luncheon meat",2602,Cold cuts and cured meats,4,Other
25230230,16.47,3.61,0.59,1.04,0.0,5.0,0.57,1203.0,0.7,41.0,1.022,638.0,105.0,"Ham, sliced, extra lean, prepackaged or deli, luncheon meat",2602,Cold cuts and cured meats,4,Other
25230310,16.47,2.44,3.58,0.9,0.0,12.0,0.38,994.0,0.1,48.0,0.561,468.0,104.0,"Chicken or turkey loaf, prepackaged or deli, luncheon meat",2602,Cold cuts and cured meats,4,Other
25230410,12.5,30.3,2.1,0.0,0.0,6.0,0.72,1289.0,0.5,62.0,10.79,215.0,334.0,"Ham loaf, luncheon meat",2602,Cold cuts and cured meats,4,Other
25230430,13.6,18.7,4.0,0.0,0.0,58.0,0.91,1080.0,1.1,58.0,6.966,294.0,241.0,Ham and cheese loaf,2602,Cold cuts and cured meats,4,Other
25230450,11.12,4.47,9.98,0.17,0.8,17.0,1.35,1320.0,1.0,34.0,1.449,343.0,125.0,Honey loaf,2602,Cold cuts and cured meats,4,Other
25230510,16.28,16.6,2.1,0.0,0.0,8.0,0.86,1313.0,0.7,59.0,5.631,305.0,227.0,"Ham, luncheon meat, chopped, minced, pressed, spiced, not canned",2602,Cold cuts and cured meats,4,Other
25230520,16.47,3.61,0.59,1.04,0.0,5.0,0.57,1203.0,0.7,41.0,1.022,638.0,105.0,"Ham, luncheon meat, chopped, minced, pressed, spiced, lowfat, not canned",2602,Cold cuts and cured meats,4,Other
25230530,13.4,26.6,4.6,0.0,0.0,0.0,0.64,1330.0,0.6,71.0,9.987,409.0,315.0,"Ham and pork, luncheon meat, chopped, minced, pressed, spiced, canned",2602,Cold cuts and cured meats,4,Other
25230540,15.23,13.9,1.35,1.26,0.0,39.0,1.4,1032.0,0.6,75.0,4.514,461.0,196.0,"Ham, pork and chicken, luncheon meat, chopped, minced, pressed, spiced, canned",2602,Cold cuts and cured meats,4,Other
25230550,12.5,25.1,3.4,0.0,0.0,0.0,0.64,946.0,0.6,76.0,8.873,564.0,293.0,"Ham, pork, and chicken, luncheon meat, chopped, minced, pressed, spiced, canned, reduced sodium",2602,Cold cuts and cured meats,4,Other
25230560,14.5,28.5,3.1,0.0,0.0,9.0,11.2,1160.0,1.2,180.0,9.307,199.0,327.0,Liverwurst,2602,Cold cuts and cured meats,4,Other
25230610,11.52,16.23,8.83,4.23,0.8,109.0,0.94,1394.0,1.0,48.0,5.568,334.0,230.0,"Luncheon loaf (olive, pickle, or pimiento)",2602,Cold cuts and cured meats,4,Other
25230710,14.65,14.64,4.23,2.76,0.2,30.0,0.62,1289.0,0.9,53.0,5.661,302.0,211.0,"Sandwich loaf, luncheon meat",2602,Cold cuts and cured meats,4,Other
25230790,19.6,3.8,2.93,0.0,0.0,5.0,1.35,1038.0,0.0,67.0,1.09,299.0,124.0,"Turkey ham, sliced, extra lean, prepackaged or deli, luncheon meat",2602,Cold cuts and cured meats,4,Other
25230800,17.5,4.84,2.04,1.43,0.2,8.0,2.34,1114.0,0.1,72.0,1.526,287.0,126.0,Turkey ham,2602,Cold cuts and cured meats,4,Other
25230810,14.4,26.2,2.9,0.0,0.0,11.0,2.32,1329.0,0.4,64.0,11.214,208.0,308.0,Veal loaf,2602,Cold cuts and cured meats,4,Other
25230820,16.3,6.21,1.79,3.34,0.1,11.0,4.2,981.0,0.2,68.0,1.699,345.0,133.0,Turkey pastrami,2602,Cold cuts and cured meats,4,Other
25230840,19.3,9.21,1.55,1.12,0.1,40.0,1.25,1004.0,0.6,76.0,2.783,216.0,172.0,Turkey salami,2602,Cold cuts and cured meats,4,Other
25230900,17.07,1.66,4.21,3.51,0.5,8.0,1.44,1015.0,0.1,43.0,0.333,302.0,104.0,"Turkey or chicken breast, prepackaged or deli, luncheon meat",2602,Cold cuts and cured meats,4,Other
25230905,22.81,0.88,4.21,3.51,0.5,8.0,0.63,772.0,0.1,44.0,0.333,211.0,116.0,"Turkey or chicken breast, low salt, prepackaged or deli, luncheon meat",2602,Cold cuts and cured meats,4,Other
25231110,17.94,3.4,2.59,0.0,0.0,6.0,2.04,1117.0,0.1,48.0,1.101,308.0,117.0,"Beef, sliced, prepackaged or deli, luncheon meat",2602,Cold cuts and cured meats,4,Other
25231150,27.1,14.93,0.0,0.0,0.0,12.0,2.08,1006.0,0.2,86.0,6.18,136.0,250.0,"Corned beef, pressed",2602,Cold cuts and cured meats,4,Other
25240000,12.5,30.3,2.1,0.0,0.0,6.0,0.72,1289.0,0.5,62.0,10.79,215.0,334.0,"Meat spread or potted meat, NFS",2602,Cold cuts and cured meats,4,Other
25240110,11.64,13.52,7.41,0.0,0.0,10.0,0.61,653.0,0.2,30.0,3.45,183.0,200.0,Chicken salad spread,2602,Cold cuts and cured meats,4,Other
25240210,12.5,30.3,2.1,0.0,0.0,6.0,0.72,1289.0,0.5,62.0,10.79,215.0,334.0,"Ham, deviled or potted",2602,Cold cuts and cured meats,4,Other
25240220,8.68,15.53,10.64,0.0,0.0,8.0,0.59,912.0,0.7,37.0,5.049,150.0,216.0,Ham salad spread,2602,Cold cuts and cured meats,4,Other
25240310,7.66,17.34,11.94,0.0,0.2,12.0,0.79,1013.0,0.6,38.0,5.977,110.0,235.0,Roast beef spread,2602,Cold cuts and cured meats,4,Other
25240320,27.1,14.93,0.0,0.0,0.0,12.0,2.08,1006.0,0.2,86.0,6.18,136.0,250.0,Corned beef spread,2602,Cold cuts and cured meats,4,Other
26100100,17.7,3.45,0.0,0.0,0.0,11.0,0.37,154.0,4.7,51.0,0.796,280.0,106.0,"Fish, NS as to type, raw",2402,Fish,1,Fish
26100170,62.82,2.37,0.0,0.0,0.0,160.0,2.5,7027.0,4.0,152.0,0.462,1458.0,290.0,"Fish, NS as to type, dried",2402,Fish,3,Fish
26100180,24.01,2.28,0.0,0.0,0.0,63.0,1.23,360.0,6.8,39.0,0.499,262.0,123.0,"Fish, NS as to type, canned",2402,Fish,3,Fish
26100190,18.74,4.74,0.0,0.0,0.0,14.0,0.76,780.0,16.1,25.0,0.929,222.0,123.0,"Fish, NS as to type, smoked",2402,Fish,3,Fish
26100210,12.27,14.72,23.53,2.78,1.6,29.0,1.12,468.0,0.4,31.0,3.064,240.0,277.0,"Fish stick, patty, or fillet, NS as to type, cooked, NS as to cooking method",2402,Fish,4,Fish
26100220,12.27,14.72,23.53,2.78,1.6,29.0,1.12,468.0,0.4,31.0,3.064,240.0,277.0,"Fish stick, patty, or fillet, NS as to type, baked or broiled",2402,Fish,4,Fish
26100230,12.27,14.72,23.53,2.78,1.6,29.0,1.12,468.0,0.4,31.0,3.064,240.0,277.0,"Fish stick, patty, or fillet, NS as to type, breaded or battered, baked",2402,Fish,4,Fish
26100240,10.72,17.72,20.56,2.43,1.4,25.0,0.98,409.0,0.4,27.0,3.313,210.0,285.0,"Fish stick, patty, or fillet, NS as to type, floured or breaded, fried",2402,Fish,4,Fish
26100250,10.42,20.05,19.98,2.36,1.3,25.0,0.96,397.0,0.4,26.0,3.589,204.0,302.0,"Fish stick, patty, or fillet, NS as to type, battered, fried",2402,Fish,4,Fish
26101110,28.89,9.71,0.0,0.0,0.0,232.0,4.63,3668.0,1.7,85.0,2.203,544.0,210.0,"Anchovy, cooked, NS as to cooking method",2402,Fish,3,Fish
26101180,28.89,9.71,0.0,0.0,0.0,232.0,4.63,3668.0,1.7,85.0,2.203,544.0,210.0,"Anchovy, canned",2402,Fish,3,Fish
26109170,62.82,2.37,0.0,0.0,0.0,160.0,2.5,7027.0,4.0,152.0,0.462,1458.0,290.0,"Cod, dried, salted",2402,Fish,3,Fish
26109180,17.9,0.68,0.0,0.0,0.0,48.0,0.71,1805.0,1.1,43.0,0.132,354.0,83.0,"Cod, dried, salted, salt removed in water",2402,Fish,3,Fish
26115000,12.41,1.93,0.0,0.0,0.0,21.0,0.18,296.0,2.8,45.0,0.441,160.0,70.0,"Flounder, raw",2402,Fish,1,Fish
26119100,17.96,9.04,0.0,0.0,0.0,57.0,1.1,90.0,4.2,60.0,2.04,327.0,158.0,"Herring, raw",2402,Fish,1,Fish
26119110,14.19,18.0,9.64,7.71,0.0,77.0,1.22,870.0,2.8,13.0,2.381,69.0,262.0,"Herring, cooked, NS as to cooking method",2402,Fish,3,Fish
26119180,14.19,18.0,9.64,7.71,0.0,77.0,1.22,870.0,2.8,13.0,2.381,69.0,262.0,"Herring, pickled",2402,Fish,3,Fish
26119190,24.58,12.37,0.0,0.0,0.0,84.0,1.51,918.0,2.2,82.0,2.791,447.0,217.0,"Herring, smoked, kippered",2402,Fish,3,Fish
26121100,19.08,11.91,0.0,0.0,0.0,16.0,1.48,89.0,13.8,62.0,2.924,344.0,189.0,"Mackerel, raw",2402,Fish,1,Fish
26121180,23.19,6.3,0.0,0.0,0.0,241.0,2.04,379.0,7.3,79.0,1.857,194.0,156.0,"Mackerel, canned",2402,Fish,3,Fish
26125100,15.31,1.54,0.0,0.0,0.0,28.0,0.22,287.0,1.2,52.0,0.273,187.0,79.0,"Ocean perch, raw",2402,Fish,1,Fish
26131100,18.48,9.47,0.0,0.0,0.0,22.0,0.6,65.0,11.0,50.0,3.509,381.0,164.0,"Pompano, raw",2402,Fish,1,Fish
26137100,21.62,5.93,0.0,0.0,0.0,36.0,0.56,46.0,9.0,45.0,1.26,423.0,146.0,"Salmon, raw",2402,Fish,1,Fish
26137170,62.88,13.5,0.0,0.0,0.0,21.0,1.17,230.0,33.4,141.0,2.485,1123.0,390.0,"Salmon, dried",2402,Fish,3,Fish
26137180,20.55,5.48,0.0,0.0,0.0,220.0,0.64,408.0,15.0,59.0,1.009,336.0,137.0,"Salmon, canned",2402,Fish,3,Fish
26137190,18.28,4.32,0.0,0.0,0.0,11.0,0.85,784.0,17.1,23.0,0.929,175.0,117.0,"Salmon, smoked",2402,Fish,3,Fish
26139110,24.62,11.45,0.0,0.0,0.0,382.0,2.92,505.0,4.8,142.0,1.528,397.0,208.0,"Sardines, cooked",2402,Fish,3,Fish
26139180,24.62,11.45,0.0,0.0,0.0,382.0,2.92,505.0,4.8,142.0,1.528,397.0,208.0,"Sardines, canned in oil",2402,Fish,3,Fish
26139190,24.58,12.37,0.0,0.0,0.0,84.0,1.51,918.0,2.2,82.0,2.791,447.0,217.0,"Sardines, skinless, boneless, packed in water",2402,Fish,3,Fish
26151190,36.94,11.76,0.0,0.0,0.0,77.0,2.67,610.0,6.9,103.0,2.044,642.0,263.0,"Trout, smoked",2402,Fish,3,Fish
26153100,24.4,0.49,0.0,0.0,0.0,4.0,0.77,45.0,1.7,39.0,0.172,441.0,109.0,"Tuna, fresh, raw",2402,Fish,1,Fish
26153170,29.16,6.12,0.0,0.0,0.0,10.0,1.27,49.0,7.1,48.0,1.571,315.0,180.0,"Tuna, fresh, dried",2402,Fish,3,Fish
26155110,25.87,1.56,0.0,0.0,0.0,11.0,1.52,340.0,4.7,29.0,0.364,234.0,124.0,"Tuna, canned, NS as to oil or water pack",2402,Fish,3,Fish
26155190,25.51,0.82,0.0,0.0,0.0,11.0,1.53,338.0,4.5,30.0,0.234,237.0,116.0,"Tuna, canned, water pack",2402,Fish,3,Fish
26211100,24.6,17.9,4.0,0.0,0.0,275.0,11.88,1500.0,2.9,588.0,4.06,181.0,264.0,"Roe, sturgeon",2402,Fish,3,Fish
26213100,15.58,1.38,3.08,0.0,0.0,32.0,0.68,44.0,0.0,233.0,0.358,246.0,92.0,"Squid, raw",2404,Shellfish,1,Fish
26213170,59.06,5.23,11.68,0.0,0.0,122.0,2.58,608.0,0.0,883.0,1.357,933.0,349.0,"Squid, dried",2404,Shellfish,3,Fish
26213190,17.9,1.59,3.54,0.0,0.0,37.0,0.74,313.0,0.0,268.0,0.411,226.0,106.0,"Squid, canned",2404,Shellfish,3,Fish
26303100,14.67,0.96,3.57,0.0,0.0,39.0,1.62,601.0,0.0,30.0,0.187,46.0,86.0,"Clams, raw",2404,Shellfish,1,Fish
26303180,18.34,1.2,4.46,0.0,0.0,49.0,1.82,751.0,0.0,38.0,0.234,52.0,108.0,"Clams, canned",2404,Shellfish,3,Fish
26305180,17.88,0.74,0.0,0.0,0.0,91.0,0.5,395.0,0.0,97.0,0.201,259.0,83.0,"Crab, canned",2404,Shellfish,3,Fish
26313100,11.9,2.24,3.69,0.0,0.0,26.0,3.95,286.0,0.0,28.0,0.425,320.0,86.0,"Mussels, raw",2404,Shellfish,1,Fish
26315100,5.71,1.71,2.72,0.62,0.0,59.0,4.61,85.0,0.0,40.0,0.474,156.0,51.0,"Oysters, raw",2404,Shellfish,1,Fish
26315180,7.67,2.68,4.25,0.0,0.0,49.0,7.28,122.0,0.0,60.0,0.686,249.0,74.0,"Oysters, canned",2404,Shellfish,3,Fish
26315190,9.2,2.76,4.38,1.0,0.0,95.0,7.43,605.0,0.0,64.0,0.764,251.0,82.0,"Oysters, smoked",2404,Shellfish,3,Fish
26319170,51.7,3.44,0.0,0.0,0.0,367.0,5.39,1967.0,0.0,638.0,0.476,203.0,253.0,"Shrimp, dried",2404,Shellfish,3,Fish
26319180,20.42,1.36,0.0,0.0,0.0,145.0,2.13,777.0,0.0,252.0,0.188,80.0,100.0,"Shrimp, canned",2404,Shellfish,3,Fish
27116400,17.79,14.56,0.59,0.23,0.1,23.0,2.06,120.0,0.3,99.0,5.641,285.0,210.0,Steak tartare (raw ground beef and egg),3002,Meat mixed dishes,3,Meat
27150210,5.06,0.01,3.64,3.64,0.0,43.0,0.78,7851.0,0.0,0.0,0.003,288.0,35.0,Fish sauce (bagoong),8412,"Dips, gravies, other sauces",4,Other
27150350,20.86,10.45,0.54,0.43,0.1,240.0,2.3,414.0,4.8,61.0,2.684,341.0,185.0,Sardines with tomato-based sauce (mixture),3006,Seafood mixed dishes,3,Fish
27150370,20.86,10.45,0.54,0.43,0.1,240.0,2.3,414.0,4.8,61.0,2.684,341.0,185.0,Sardines with mustard sauce (mixture),3006,Seafood mixed dishes,3,Fish
27211400,8.73,10.24,9.27,0.34,1.1,19.0,1.0,412.0,0.0,32.0,4.32,172.0,164.0,Corned beef hash,3002,Meat mixed dishes,4,Meat
27214500,8.73,10.24,9.27,0.34,1.1,19.0,1.0,412.0,0.0,32.0,4.32,172.0,164.0,Corned beef patty,3002,Meat mixed dishes,4,Meat
27250520,7.62,0.46,15.0,6.25,0.5,13.0,0.39,841.0,0.0,20.0,0.176,90.0,95.0,Seafood restructured,2402,Fish,4,Fish
27260110,8.73,10.24,9.27,0.34,1.1,19.0,1.0,412.0,0.0,32.0,4.32,172.0,164.0,"Hash, NS as to type of meat",3002,Meat mixed dishes,4,Meat
27347100,6.08,10.83,23.03,3.81,1.2,29.0,1.1,380.0,0.1,24.0,3.613,124.0,214.0,Chicken or turkey pot pie,3004,Poultry mixed dishes,4,Meat
27510300,11.94,14.1,21.53,3.26,1.4,127.0,1.4,485.0,0.1,36.0,5.045,182.0,261.0,"Double cheeseburger (2 patties), with mayonnaise or salad dressing, on double-decker bun",3702,Burgers (single code),4,Other
27510310,13.49,12.9,25.46,5.24,1.9,123.0,2.25,628.0,0.1,39.0,5.797,184.0,270.0,"Cheeseburger with tomato and/or catsup, on bun",3702,Burgers (single code),4,Other
27510320,15.21,14.4,19.72,3.6,1.2,179.0,1.02,591.0,0.1,48.0,7.033,223.0,269.0,"Cheeseburger, 1/4 lb meat, with tomato and/or catsup, on bun",3702,Burgers (single code),4,Other
27510330,17.0,13.65,18.73,4.18,0.9,163.0,2.09,507.0,0.2,50.0,6.331,241.0,268.0,"Double cheeseburger (2 patties), with tomato and/or catsup, on bun",3702,Burgers (single code),4,Other
27510350,13.03,13.46,15.45,4.51,1.2,78.0,2.17,465.0,0.1,37.0,5.487,178.0,235.0,"Cheeseburger, 1/4 lb meat, with mayonnaise or salad dressing, and tomato and/or catsup, on bun",3702,Burgers (single code),4,Other
27510510,13.07,10.07,28.79,5.22,1.8,74.0,2.53,491.0,0.1,29.0,4.0,183.0,258.0,"Hamburger, with tomato and/or catsup, on bun",3702,Burgers (single code),4,Other
27510560,11.34,12.37,17.33,4.0,1.5,46.0,2.99,342.0,0.1,33.0,3.972,188.0,226.0,"Hamburger, 1/4 lb meat, with mayonnaise or salad dressing, and tomato and/or catsup, on bun",3702,Burgers (single code),4,Other
27510620,15.68,11.6,22.14,3.67,1.1,87.0,1.73,374.0,0.1,40.0,4.785,225.0,256.0,"Hamburger, 1/4 lb meat, with tomato and/or catsup, on bun",3702,Burgers (single code),4,Other
27510690,13.94,15.66,13.74,3.52,1.4,35.0,2.8,289.0,0.1,46.0,5.773,192.0,252.0,"Double hamburger (2 patties, 1/4 lb meat each), with mayonnaise or salad dressing and tomatoes and/or catsup, on double-decker bun",3702,Burgers (single code),4,Other
27520135,17.19,8.05,19.87,4.68,1.2,95.0,1.37,630.0,0.1,46.0,3.109,226.0,220.0,"Bacon, chicken, and tomato club sandwich, with cheese, lettuce and spread",3704,Chicken/turkey sandwiches (single code),4,Other
27520166,15.38,11.76,22.61,4.99,1.2,92.0,1.32,605.0,0.2,38.0,3.372,256.0,257.0,"Bacon, chicken fillet (breaded, fried), and tomato club sandwich with cheese, lettuce and spread",3704,Chicken/turkey sandwiches (single code),4,Other
27520250,11.85,16.3,38.75,1.97,0.7,142.0,2.41,1268.0,0.3,22.0,10.096,174.0,342.0,Ham on biscuit,3706,Egg/breakfast sandwiches (single code),4,Other
27540150,12.42,11.7,22.46,2.48,1.4,78.0,1.23,650.0,0.0,29.0,2.119,205.0,245.0,"Chicken fillet (breaded, fried) sandwich with lettuce, tomato and spread",3704,Chicken/turkey sandwiches (single code),4,Other
27540235,17.34,4.57,16.78,3.08,0.9,62.0,1.58,427.0,0.1,40.0,0.949,197.0,182.0,"Chicken fillet, broiled, sandwich with lettuce, tomato, and spread",3704,Chicken/turkey sandwiches (single code),4,Other
27560300,7.93,12.95,29.71,8.82,1.0,56.0,1.86,628.0,0.4,36.0,3.794,136.0,267.0,Corn dog (frankfurter or hot dog with cornbread coating),3708,Other sandwiches (single code),4,Other
27560650,9.67,24.42,29.99,1.59,0.4,47.0,1.86,814.0,0.3,28.0,7.427,153.0,371.0,Sausage on biscuit,3706,Egg/breakfast sandwiches (single code),4,Other
27560660,8.41,17.76,31.25,11.23,1.0,63.0,1.42,737.0,0.2,24.0,5.363,145.0,318.0,Sausage griddle cake sandwich,3706,Egg/breakfast sandwiches (single code),4,Other
27560670,13.28,20.67,25.28,1.98,0.5,210.0,3.14,668.0,0.4,43.0,8.152,179.0,338.0,Sausage and cheese on English muffin,3706,Egg/breakfast sandwiches (single code),4,Other
27601000,5.1,1.2,5.5,1.39,1.1,9.0,0.72,106.0,0.0,13.0,0.58,142.0,51.0,"Beef stew, baby food, toddler",9008,Baby food: meat and dinners,3,Other
27610100,2.47,2.08,7.74,1.44,1.2,9.0,0.42,20.0,0.0,8.0,0.852,66.0,60.0,"Beef and egg noodles, baby food, NS as to strained or junior",9008,Baby food: meat and dinners,3,Other
27610110,2.44,2.26,8.18,1.42,1.3,10.0,0.41,15.0,0.0,8.0,0.937,87.0,63.0,"Beef and egg noodles, baby food, strained",9008,Baby food: meat and dinners,3,Other
27610120,2.5,1.9,7.3,1.45,1.1,8.0,0.43,26.0,0.0,8.0,0.766,46.0,57.0,"Beef and egg noodles, baby food, junior",9008,Baby food: meat and dinners,3,Other
27610710,2.03,6.93,6.36,2.16,1.8,19.0,0.33,38.0,0.0,12.0,2.84,127.0,96.0,"Beef with vegetables, baby food, strained",9008,Baby food: meat and dinners,3,Other
27610730,3.5,2.1,8.72,1.18,0.5,11.0,0.5,26.0,0.0,12.0,0.847,168.0,68.0,"Beef with vegetables, baby food, toddler",9008,Baby food: meat and dinners,3,Other
27640050,1.6,0.9,9.2,0.55,1.1,18.0,0.2,25.0,0.0,10.0,0.211,60.0,51.0,"Chicken and rice dinner, baby food, strained",9008,Baby food: meat and dinners,3,Other
27640100,2.53,1.62,8.94,1.78,1.5,24.0,0.51,36.0,0.0,12.0,0.466,89.0,60.0,"Chicken noodle dinner, baby food, NS as to strained or junior",9008,Baby food: meat and dinners,3,Other
27640110,2.69,2.06,9.08,2.5,2.1,27.0,0.64,38.0,0.1,16.0,0.595,139.0,66.0,"Chicken noodle dinner, baby food, strained",9008,Baby food: meat and dinners,3,Other
27640120,2.37,1.18,8.79,1.07,0.9,21.0,0.38,35.0,0.0,9.0,0.338,39.0,55.0,"Chicken noodle dinner, baby food, junior",9008,Baby food: meat and dinners,3,Other
27640810,3.8,1.7,8.89,0.82,0.6,11.0,0.4,235.0,0.0,28.0,0.461,95.0,66.0,"Chicken, noodles, and vegetables, baby food, toddler",9008,Baby food: meat and dinners,3,Other
27641000,5.2,3.7,6.4,1.68,0.6,36.0,0.66,25.0,0.2,29.0,1.1,92.0,78.0,"Chicken stew, baby food, toddler",9008,Baby food: meat and dinners,3,Other
27642100,2.32,1.08,8.76,1.46,1.0,21.0,0.35,21.0,0.0,4.0,0.288,88.0,54.0,"Turkey, rice and vegetables, baby food, NS as to strained or junior",9008,Baby food: meat and dinners,3,Other
27642110,2.27,1.24,7.94,1.66,0.9,18.0,0.29,19.0,0.0,5.0,0.338,91.0,52.0,"Turkey, rice and vegetables, baby food, strained",9008,Baby food: meat and dinners,3,Other
27642120,2.37,0.92,9.57,1.25,1.0,24.0,0.41,23.0,0.0,4.0,0.239,86.0,56.0,"Turkey, rice and vegetables, baby food, junior",9008,Baby food: meat and dinners,3,Other
27642130,3.8,1.6,7.5,0.66,0.8,11.0,0.4,276.0,0.0,7.0,0.5,107.0,60.0,"Turkey, rice, and vegetables, baby food, toddler",9008,Baby food: meat and dinners,3,Other
27644110,1.6,1.7,7.2,1.72,1.1,37.0,0.27,16.0,0.1,4.0,0.278,66.0,50.0,"Chicken soup, baby food",9008,Baby food: meat and dinners,3,Other
28101000,8.72,8.76,10.94,1.43,1.3,21.0,0.81,355.0,0.2,41.0,3.653,183.0,158.0,"Frozen dinner, NFS",3002,Meat mixed dishes,4,Meat
28110000,6.93,8.39,11.24,1.62,1.3,16.0,0.84,271.0,0.2,40.0,4.176,194.0,147.0,"Beef dinner, NFS (frozen meal)",3002,Meat mixed dishes,4,Meat
28110120,11.49,9.27,12.32,3.66,1.6,34.0,1.7,517.0,0.1,31.0,3.481,345.0,180.0,"Beef with potatoes (frozen meal, large meat portion)",3002,Meat mixed dishes,4,Meat
28110150,10.64,6.95,4.68,2.81,0.8,34.0,1.32,293.0,0.1,34.0,2.675,281.0,125.0,Beef with vegetable (diet frozen meal),3002,Meat mixed dishes,4,Meat
28110200,7.81,7.88,12.95,1.96,1.6,15.0,1.15,555.0,0.2,38.0,3.728,229.0,153.0,"Sirloin, chopped, dinner, NFS (frozen meal)",3002,Meat mixed dishes,4,Meat
28110220,7.92,7.99,13.12,1.99,1.7,15.0,1.17,563.0,0.2,39.0,3.781,232.0,155.0,"Sirloin, chopped, with gravy, mashed potatoes, vegetable (frozen meal)",3002,Meat mixed dishes,4,Meat
28110250,8.25,5.68,7.06,1.4,1.1,13.0,1.29,265.0,0.1,24.0,2.23,262.0,113.0,"Sirloin tips with gravy, potatoes, vegetable (frozen meal)",3002,Meat mixed dishes,4,Meat
28110270,8.39,2.82,6.46,0.98,1.2,16.0,0.81,312.0,0.0,22.0,1.287,236.0,85.0,"Sirloin beef with gravy, potatoes, vegetable (frozen meal)",3002,Meat mixed dishes,4,Meat
28110300,6.93,8.39,11.24,1.62,1.3,16.0,0.84,271.0,0.2,40.0,4.176,194.0,147.0,"Salisbury steak dinner, NFS (frozen meal)",3002,Meat mixed dishes,4,Meat
28110310,6.93,8.39,11.24,1.62,1.3,16.0,0.84,271.0,0.2,40.0,4.176,194.0,147.0,"Salisbury steak with gravy, potatoes, vegetable (frozen meal)",3002,Meat mixed dishes,4,Meat
28110330,7.62,6.71,12.28,2.34,0.8,26.0,1.07,560.0,0.1,25.0,2.599,169.0,140.0,"Salisbury steak with gravy, whipped potatoes, vegetable, dessert (frozen meal)",3002,Meat mixed dishes,4,Meat
28110340,6.66,4.96,9.75,2.56,1.0,24.0,0.92,337.0,0.1,21.0,2.215,165.0,111.0,"Salisbury steak with gravy, potatoes, vegetable, soup or macaroni and cheese, dessert (frozen meal)",3002,Meat mixed dishes,4,Meat
28110350,11.15,7.47,14.04,2.57,1.6,31.0,1.63,386.0,0.1,28.0,2.577,277.0,169.0,"Salisbury steak with gravy, potatoes, vegetable, dessert (frozen meal, large meat portion)",3002,Meat mixed dishes,4,Meat
28110370,10.47,7.26,10.4,1.78,1.1,101.0,1.33,539.0,0.5,31.0,2.872,179.0,149.0,"Salisbury steak with gravy, macaroni and cheese, vegetable (frozen meal)",3002,Meat mixed dishes,4,Meat
28110380,10.75,8.45,20.07,1.82,1.3,116.0,1.68,373.0,0.1,24.0,3.35,136.0,202.0,"Salisbury steak with gravy, macaroni and cheese (frozen meal)",3002,Meat mixed dishes,4,Meat
28110390,4.8,2.81,12.72,8.1,1.3,14.0,0.68,133.0,0.0,14.0,1.032,165.0,93.0,"Salisbury steak, potatoes, vegetable, dessert (diet frozen meal)",3002,Meat mixed dishes,4,Meat
28110510,8.06,7.24,7.06,0.75,0.8,10.0,0.93,304.0,0.1,21.0,2.035,222.0,136.0,"Beef, sliced, with gravy, potatoes, vegetable (frozen meal)",3002,Meat mixed dishes,4,Meat
28110620,8.95,5.62,14.81,6.05,1.4,19.0,1.18,200.0,0.1,26.0,2.508,250.0,146.0,"Beef short ribs, boneless, with barbecue sauce, potatoes, vegetable (frozen meal)",3002,Meat mixed dishes,4,Meat
28110640,11.18,10.38,12.8,0.93,0.6,49.0,1.56,296.0,0.2,45.0,4.434,177.0,193.0,"Meatballs, Swedish, in sauce, with noodles (frozen meal)",3002,Meat mixed dishes,4,Meat
28110660,9.52,3.35,10.71,1.29,1.0,24.0,1.34,253.0,0.1,13.0,1.182,147.0,112.0,"Meatballs, Swedish, in gravy, with noodles (diet frozen meal)",3002,Meat mixed dishes,4,Meat
28111010,6.98,6.14,15.08,8.2,1.7,18.0,0.82,817.0,0.1,22.0,2.563,135.0,142.0,"Corned beef hash with apple slices, vegetable (frozen meal)",3002,Meat mixed dishes,4,Meat
28113110,9.0,5.67,4.71,1.78,0.8,51.0,1.21,270.0,0.1,30.0,2.19,251.0,106.0,"Salisbury steak, baked, with tomato sauce, vegetable (diet frozen meal)",3002,Meat mixed dishes,4,Meat
28113140,6.99,4.34,12.56,1.36,0.5,9.0,1.14,279.0,0.0,16.0,1.284,155.0,119.0,"Beef with spaetzle or rice, vegetable (frozen meal)",3002,Meat mixed dishes,4,Meat
28120310,5.28,2.25,15.23,2.97,0.9,11.0,0.74,416.0,0.2,12.0,0.664,168.0,104.0,"Pork with rice, vegetable, in soy-based sauce (diet frozen meal)",3404,Stir-fry and soy-based sauce mixtures,4,Other
28130000,6.36,6.26,11.91,2.03,1.1,25.0,1.02,375.0,0.0,23.0,1.496,197.0,129.0,"Veal dinner, NFS (frozen meal)",3002,Meat mixed dishes,4,Meat
28133110,6.36,6.26,11.91,2.03,1.1,25.0,1.02,375.0,0.0,23.0,1.496,197.0,129.0,"Veal, breaded, with spaghetti, in tomato sauce (frozen meal)",3002,Meat mixed dishes,4,Meat
28133210,8.05,3.44,3.01,1.83,0.7,100.0,0.7,184.0,0.0,28.0,1.83,269.0,74.0,Veal parmigiana with vegetable (diet frozen meal),3002,Meat mixed dishes,4,Meat
28133220,7.18,2.0,8.83,2.04,1.0,17.0,0.89,243.0,0.0,25.0,0.764,238.0,81.0,"Veal with peppers in sauce, rice (diet frozen meal)",3002,Meat mixed dishes,4,Meat
28133340,6.19,6.89,13.27,4.92,1.1,75.0,0.9,382.0,0.1,27.0,2.426,163.0,138.0,"Veal parmigiana with vegetable, fettuccine alfredo, dessert (frozen meal)",3002,Meat mixed dishes,4,Meat
28140100,9.98,8.82,13.46,3.62,1.3,31.0,0.82,425.0,0.2,38.0,2.901,163.0,175.0,"Chicken dinner, NFS (frozen meal)",3004,Poultry mixed dishes,4,Meat
28140150,8.98,9.18,6.8,3.08,0.5,107.0,0.65,280.0,0.2,34.0,3.729,158.0,152.0,Chicken divan (frozen meal),3004,Poultry mixed dishes,4,Meat
28140250,9.22,5.7,20.87,5.34,1.5,24.0,1.33,272.0,0.2,22.0,1.612,143.0,174.0,"Chicken, boneless, with gravy, dressing, rice, vegetable, dessert (frozen meal, large meat portion)",3004,Poultry mixed dishes,4,Meat
28140320,6.08,4.91,17.88,4.56,1.3,15.0,1.06,366.0,0.1,16.0,1.236,154.0,140.0,"Chicken and noodles with vegetable, dessert (frozen meal)",3004,Poultry mixed dishes,4,Meat
28140710,10.51,9.13,10.64,1.24,1.3,26.0,0.79,439.0,0.2,41.0,3.129,173.0,169.0,"Chicken, fried, with potatoes, vegetable (frozen meal)",3004,Poultry mixed dishes,4,Meat
28140720,10.68,10.34,18.22,1.55,1.6,9.0,0.78,442.0,0.0,24.0,2.016,275.0,205.0,"Chicken patty, or nuggets, boneless, breaded, potatoes, vegetable (frozen meal)",3004,Poultry mixed dishes,4,Meat
28140730,9.41,5.68,8.42,1.33,1.2,40.0,0.83,262.0,0.1,32.0,1.902,154.0,122.0,"Chicken patty, breaded, with tomato sauce and cheese, fettuccine alfredo, vegetable (frozen meal)",3004,Poultry mixed dishes,4,Meat
28140740,5.11,6.8,24.43,10.41,1.5,15.0,1.06,401.0,0.1,14.0,1.399,164.0,177.0,"Chicken patty, or nuggets, boneless, breaded, with pasta and tomato sauce, fruit, dessert (frozen meal)",3004,Poultry mixed dishes,4,Meat
28140810,9.98,8.82,13.46,3.62,1.3,31.0,0.82,425.0,0.2,38.0,2.901,163.0,175.0,"Chicken, fried, with potatoes, vegetable, dessert (frozen meal)",3004,Poultry mixed dishes,4,Meat
28140910,6.39,6.5,18.48,6.97,1.7,42.0,0.84,215.0,0.2,24.0,2.272,149.0,156.0,"Chicken, fried, with potatoes, vegetable, cornbread, dessert (frozen meal)",3004,Poultry mixed dishes,4,Meat
28140920,8.83,7.24,14.94,4.0,0.9,19.0,0.8,237.0,0.1,32.0,2.385,141.0,161.0,"Chicken, fried, with potatoes, vegetable, vegetable soup, dessert (frozen meal)",3004,Poultry mixed dishes,4,Meat
28141010,11.34,10.62,18.36,5.07,1.5,19.0,0.93,394.0,0.1,42.0,2.56,220.0,212.0,"Chicken, fried, with potatoes, vegetable, dessert (frozen meal, large meat portion)",3004,Poultry mixed dishes,4,Meat
28141050,9.87,7.83,6.58,1.58,1.2,120.0,0.9,429.0,0.1,25.0,2.73,159.0,136.0,"Chicken patty parmigiana, breaded, with vegetable (diet frozen meal)",3004,Poultry mixed dishes,4,Meat
28141201,5.65,1.56,22.46,4.07,0.7,13.0,0.35,333.0,0.0,16.0,0.327,123.0,126.0,Teriyaki chicken with rice and vegetable (diet frozen meal),3404,Stir-fry and soy-based sauce mixtures,4,Other
28141250,10.41,3.3,10.43,1.16,0.8,14.0,0.66,336.0,0.1,26.0,0.727,146.0,113.0,Chicken with rice-vegetable mixture (diet frozen meal),3004,Poultry mixed dishes,4,Meat
28141300,8.24,2.02,12.12,0.55,1.1,17.0,0.79,199.0,0.0,20.0,0.538,122.0,100.0,"Chicken with rice and vegetable, reduced fat and sodium (diet frozen meal)",3004,Poultry mixed dishes,4,Meat
28141600,7.28,8.32,14.97,1.01,0.5,40.0,0.95,394.0,0.3,44.0,2.897,113.0,165.0,Chicken a la king with rice (frozen meal),3004,Poultry mixed dishes,4,Meat
28141610,10.53,3.16,5.98,2.46,0.8,48.0,0.77,250.0,0.0,26.0,0.717,165.0,96.0,Chicken and vegetables in cream or white sauce (diet frozen meal),3004,Poultry mixed dishes,4,Meat
